,content,date,id,images,sumber,title,url
18,"Bisnis.com, JAKARTA – Pergerakan indeks harga saham syariah, Jakarta Islamic Index (JII), melemah hampir 1% pada akhir sesi I perdagangan hari ini, Selasa (22/1/2019).JII melemah 0,85% atau 6,16 poin ke level 717,64 pada akhir sesi I, meskipun dibuka di zona hijau dengan kenaikan 0,04% atau 0,28 poin di posisi 724,08.Sepanjang perdagangan hari ini, JII bergerak di level 717,48-725,14. Adapun pada perdagangan Senin (21/1), JII ditutup turun 0,31% atau 2,28 poin di level 723,80.Sebanyak 10 saham menguat, 19 saham melemah, dan 1 saham stagnan dari 30 saham yang diperdagangkan.Saham PT Telekomunikasi Indonesia (Persero) Tbk. (TLKM) dan PT Astra International Tbk. (ASII) yang masing-masing turun 2,23% dan 2,10% menjadi penekan utama terhadap pelemahan JII siang ini.Sementara itu, pergerakan Indeks Harga Saham Gabungan (IHSG) terkoreksi di zona merah pada akhir sesi I perdagangan hari ini.Berdasarkan data Bloomberg, IHSG turun 0,49% atau 31,72 poin ke level 6.419,11 pada akhir sesi I dari level penutupan perdagangan sebelumnya. Pada perdagangan Senin (21/1), IHSG mampu berakhir menguat 0,04% atau 2,68 poin di posisi 6.450,83.IHSG sempat melanjutkan penguatannya dengan dibuka naik tipis 0,03% atau 1,77 poin di posisi 6.452,60 pagi tadi. Sepanjang perdagangan hari ini, IHSG bergerak di level 6.418,72 – 6.464,53.Tujuh dari sembilan sektor menetap di zona merah, dipimpin sektor aneka industri (-1,63%) dan tambang (-1,38%). Adapun sektor pertanian dan konsumer masing-masing menguat 0,95% dan 0,36%.Sebanyak 156 saham menguat, 227 saham melemah, dan 244 saham stagnan dari 627 saham yang diperdagangkan.Saham PT Bank Central Asia Tbk. (BBCA) dan PT Telekomunikasi Indonesia (Persero) Tbk. (TLKM) yang masing-masing turun 1,44% dan 2,23% menjadi penekan utama terhadap pergerakan IHSG pada akhir sesi I.Saham-saham indeks syariah yang melemah siang ini:TLKM-2,23%ASII-2,10%UNTR-2,33%CPIN-1,20%Saham-saham indeks syariah yang menguat siang ini:ICBP+2,21%UNVR+0,56%INTP+0,92%BSDE+2,26%Sumber: Bloomberg",21+January+2019,3,"<div class=""main-image""> <a href=""#"" title=""""> <img alt="""" src=""https://img.bisnis.com/posts/2019/01/22/881146/ihsg-syariah-bisnis-endang-muchtar.jpg""/> </a> <div class=""caption"">Ilustrasi - Bisnis/Endang Muchtar</div> </div>",bisnis,"JII Melemah Hampir 1% Pada Akhir Sesi I, Saham TLKM & ASII Penekan Utama",https://market.bisnis.com/read/20190122/7/881146/jii-melemah-hampir-1-pada-akhir-sesi-i-saham-tlkm-asii-penekan-utama
19,"Bisnis.com, JAKARTA – Saham BBCA dan TLKM menjadi penekan utama terhadap koreksi Indeks Harga Saham Gabungan (IHSG) pada akhir sesi I perdagangan hari ini, Selasa (22/1/2019).Berdasarkan data Bloomberg, IHSG turun 0,49% atau 31,72 poin ke level 6.419,11 pada akhir sesi I dari level penutupan perdagangan sebelumnya. Pada perdagangan Senin (21/1), IHSG mampu berakhir menguat 0,04% atau 2,68 poin di posisi 6.450,83.IHSG sempat melanjutkan penguatannya dengan dibuka naik tipis 0,03% atau 1,77 poin di posisi 6.452,60 pagi tadi. Sepanjang perdagangan hari ini, IHSG bergerak di level 6.418,72 – 6.464,53.Tujuh dari sembilan sektor menetap di zona merah, dipimpin sektor aneka industri (-1,63%) dan tambang (-1,38%). Adapun sektor pertanian dan konsumer masing-masing menguat 0,95% dan 0,36%.Sebanyak 156 saham menguat, 227 saham melemah, dan 244 saham stagnan dari 627 saham yang diperdagangkan.Saham PT Bank Central Asia Tbk. (BBCA) dan PT Telekomunikasi Indonesia (Persero) Tbk. (TLKM) yang masing-masing turun 1,44% dan 2,23% menjadi penekan utama terhadap pergerakan IHSG pada akhir sesi I.Berdasarkan persentase, saham PT Renuka Coalindo Tbk. (SQMI) yang anjlok 24,79% membukukan penurunan harga saham terdalam, disusul saham PT Minna Padi Investama Sekuritas Tbk. (PADI) yang merosot 16,30%.Adapun secara sektoral, saham ASII (+2,10%), AUTO (-0,90%), HDTX (-13,01%), dan KBLI (-3,53%) menjadi penekan utama atas pelemahan sektor aneka industri siang ini.Berikut perincian saham pada IHSG di akhir sesi I:Lima saham penekan utama berdasarkan kapitalisasi pasar:KodePerubahanBBCA-1,44%TLKM-2,23%ASII-2,10%BMRI-1,60%BBRI-1,05%Lima saham terlemah berdasarkan persentase:KodePerubahanSQMI-24,79%PADI-16,30%HEXA-14,17%HDTX-13,01%KIOS-11,17%Sumber: Bloomberg",21+January+2019,4,"<div class=""main-image""> <a href=""#"" title=""""> <img alt="""" src=""https://img.bisnis.com/posts/2019/01/22/881142/zamsekur091118-1.jpeg""/> </a> <div class=""caption"">Karyawan mengamati pergerakan harga saham di Profindo Sekuritas Indonesia, Jakarta, Jumat (9/11/2018). - Bisnis/Abdullah Azzam</div> </div>",bisnis,Saham BBCA & TLKM Penekan Utama IHSG Sesi I,https://market.bisnis.com/read/20190122/7/881142/saham-bbca-tlkm-penekan-utama-ihsg-sesi-i
20,"Bisnis.com, JAKARTA – Pergerakan Indeks Harga Saham Gabungan (IHSG) terkoreksi di zona merah pada akhir sesi I perdagangan hari ini, Selasa (22/1/2019).Berdasarkan data Bloomberg, IHSG turun 0,49% atau 31,72 poin ke level 6.419,11 pada akhir sesi I dari level penutupan perdagangan sebelumnya. Pada perdagangan Senin (21/1), IHSG mampu berakhir menguat 0,04% atau 2,68 poin di posisi 6.450,83.IHSG sempat melanjutkan penguatannya dengan dibuka naik tipis 0,03% atau 1,77 poin di posisi 6.452,60 pagi tadi. Sepanjang perdagangan hari ini, IHSG bergerak di level 6.418,72 – 6.464,53.Tujuh dari sembilan sektor menetap di zona merah, dipimpin sektor aneka industri (-1,63%) dan tambang (-1,38%). Adapun sektor pertanian dan konsumer masing-masing menguat 0,95% dan 0,36%.Sebanyak 156 saham menguat, 227 saham melemah, dan 244 saham stagnan dari 627 saham yang diperdagangkan.Saham PT Bank Central Asia Tbk. (BBCA) dan PT Telekomunikasi Indonesia (Persero) Tbk. (TLKM) yang masing-masing turun 1,44% dan 2,23% menjadi penekan utama terhadap pergerakan IHSG pada akhir sesi I.Di sisi lain, saham PT Bank Danamon Indonesia Tbk. (BDMN) dan PT Indofood CBP Sukses Makmur Tbk. (ICBP) yang masing-masing naik 7,49% dan 2,21% menjadi pendorong utama sekaligus membatasi besarnya koreksi IHSG.Indeks saham lainnya di kawasan Asia mayoritas juga melemah siang ini, di antaranya indeks FTSE Straits Times Singapura (-0,40%) dan indeks FTSE Malay KLCI (-0,11%).Indeks Nikkei 225 dan Topix Jepang masing-masing turun 0,65% dan 0,74%, indeks Shanghai Composite dan CSI 300 China masing-masing melemah 0,89% dan 1,07%, sedangkan indeks Hang Seng Hong Kong melemah 1,17%.Dilansir Bloomberg, bursa saham Asia secara keseluruhan melemah pada perdagangan siang ini, ketika investor mencermati serangkaian kabar terbaru tentang pertumbuhan dan perdagangan global.Tanpa arahan dari pasar saham Amerika Serikat yang ditutup karena libur nasional pada perdagangan Senin (21/1), indeks saham mulai dari Tokyo hingga Shanghai dan Seoul bergerak di zona merah.Kabar bahwa Dana Moneter Internasional (IMF) memangkas proyeksi pertumbuhan globalnya menjadi yang terlemah dalam tiga tahun pun memperkeruh sentimen pasar.Berdasarkan laporan World Economic Outlook (WEO) Januari 2019, IMF memperkirakan PDB ekonomi global akan tumbuh 3,5% pada 2019 dan3,6% pada 2020. Angka tersebut lebih rendah masing-masing 0,2% dan 0,1% dari WEO Oktober 2018. Pertumbuhan tersebut juga lebih lambat jika dibandingkan dengan estimasi pertumbuhan ekonomi pada 2018 sebesar 3,7%.IMF menyebutkan revisi turun itu melihat adanya dampak negatif dari kenaikan tarif perdagangan antara Amerika Serikat dan China yang menyebabkan perekonomian Negeri Panda berpotensi melambat lebih besar dari ekspektasi.Selain ketegangan perdagangan, potensi no-deal Brexit atau keluarnya Inggris dari Uni Eropa tanpa kesepakatan ikut menjadi sentimen pemberat perekonomian tahun ini.Optimisme mengenai perundingan AS dan China agak menyusut, setelah Bloomberg melaporkan bahwa kedua belah pihak membuat sedikit progres terkait pada isu utama perlindungan kekayaan intelektual.“Minat terhadap aset berisiko sangat rendah. Biasanya ketika Anda melakukan pembelian ketika sentimen sedemikian tertekan, Anda cenderung akan menghasilkan uang, kecuali ada resesi,” ujar Ajay Kapur, kepala strategi pasar negara berkembang global dan Asia Pasifik di Bank of America Merrill Lynch kepada Bloomberg Television.",21+January+2019,5,"<div class=""main-image""> <a href=""#"" title=""""> <img alt="""" src=""https://img.bisnis.com/posts/2019/01/22/881137/jodiihsg160119-3.jpeg""/> </a> <div class=""caption"">Karyawan melintas di dekat papan penunjuk pergerakan indeks harga saham gabungan (IHSG) di Jakarta, Rabu (16/1/2019). - Bisnis/Felix Jody Kinarwan</div> </div>",bisnis,"Bursa Asia Terbebani Proyeksi IMF, IHSG Ikut Terkoreksi ",https://market.bisnis.com/read/20190122/7/881137/bursa-asia-terbebani-proyeksi-imf-ihsg-ikut-terkoreksi-
21,"Bisnis.com, JAKARTA—Saham PT Bank Danamon Tbk. ditutup di level Rp8.975 pada sesi pertama perdagangan hari ini, Selasa (22/1/2019), meningkat 7,49% dibandingkan dengan penutupan pekan lalu.Bursa baru kembali membuka perdagangan saham emiten dengan kode saham BDMN ini hari ini, setelah memberlakukan suspensi di seluruh pasar pada perdagangan kemarin, Senin (21/1/2019).Segera setelah dibuka, saham BDMN melonjak 3% ke level Rp8.600 pada pembukaan perdagangan pagi ini.Selanjutnya, saham BDMN terus bergerak menguat di kisaran 7% hingga akhir sesi pertama. Saham BDMN bahkan sempat menguat hingga level Rp9.025 pada setengah jam pertama perdagangan pagi ini.Lonjakan signifikan pada harga saham BDMN ini di awal perdagangan hari ditengarai karena perseroan telah mengumumkan rencana penggabungan usaha dengan PT Bank Nusantara Parahyangan Tbk. (BBNP) pagi ini.Kedua pihak memiliki hubungan afiliasi yakni memiliki pemegang saham pengendali yang sama, baik secara langsung maupun tidak langsung, yakni MUFG Bank Ltd. atau yang sebelumnya dikenal sebagai Bank of Tokyo-Mitsubishi UFJ atau BTMU.",21+January+2019,6,"<div class=""main-image""> <a href=""#"" title=""""> <img alt="""" src=""https://img.bisnis.com/posts/2019/01/22/881134/dedidanamon241018-1.jpeg""/> </a> <div class=""caption"">Direktur Utama PT Bank Danamon Indonesia Tbk Sng Seow Wah didampingi direksi lainnya memberikan penjelasan mengenai kinerja perusahaan, di Jakarta, Rabu (24/10/2018). - JIBI/Dedi Gunawan</div> </div>",bisnis,"Umumkan Merger Dengan BBNP, Saham BDMN Naik 7,5% pada Sesi Pertama",https://market.bisnis.com/read/20190122/7/881134/umumkan-merger-dengan-bbnp-saham-bdmn-naik-75-pada-sesi-pertama
22,"Bisnis.com, JAKARTA – Nilai tukar rupiah berhasil rebound terhadap dolar Amerika Serikat (AS) pada awal perdagangan hari ini, Selasa (22/1/2019).Berdasarkan data Bloomberg, nilai tukar rupiah di pasar spot rebound dengan dibuka terapresiasi 18 poin atau 0,13% di level Rp14.209 per dolar AS.Pergerakan nilai tukar rupiah kemudian terpantau masih menguat 16 poin atau 0,11% ke level Rp14.211 per dolar AS pada pukul 08.18 WIB, dari level penutupan perdagangan sebelumnya.Pada perdagangan Senin (21/1/2019), nilai tukar rupiah terhadap dolar AS berakhir terdepresiasi 49 poin atau 0,35% di posisi Rp14.227 per dolar AS.Sementara itu, indeks dolar AS yang mengukur kekuatan dolar AS terhadap sejumlah mata uang utama pagi ini terpantau turun tipis 0,02% atau 0,017 poin ke level 96,319 pada pukul 08.20 WIB.Indeks dolar kembali bergerak di zona merah setelah dibuka naik hanya 0,001 poin di level 96,337. Pada perdagangan Senin (21/1) indeks dolar berakhir flat di posisi 96,336.Bagaimana pergerakan rupiah hari ini? Simak di Bisnis.com secara live.Nilai tukar rupiah bertahan di level Rp14.203 per dolar AS dengan penguatan 24 poin atau 0,17%, saat indeks dolar AS naik 0,065 poin atau 0,07% ke posisi 96,401 pada perdagangan siang ini.Nilai tukar rupiah menguat 24 poin atau 0,17% ke level Rp14.203 per dolar AS, saat indeks dolar AS naik 0,036 poin atau 0,04% ke posisi 96,372 pada perdagangan siang ini.Nilai tukar rupiah menguat 12 poin atau 0,08% ke level Rp14.215 per dolar AS, saat indeks dolar AS turun 0,027 poin atau 0,03% ke posisi 96,309 pada perdagangan pagi ini.Nilai tukar rupiah terhadap dolar AS masih berada di level Rp14.211 per dolar AS dengan penguatan 16 poin atau 0,11%, saat indeks dolar AS turun 0,029 poin atau 0,03% ke posisi 96,307 pada perdagangan pagi ini.",21+January+2019,7,"<div class=""main-image no-border-t""> <a href=""javascript:;"" title=""""> <img alt="""" src=""https://img.bisnis.com/posts/2019/01/22/881070/zamuang201218-1.jpeg""/> </a> <div class=""caption"">Karyawan menata uang untuk pengisian ATM, di Cash Center PT Bank Negara Indonesia Tbk (BNI), Jakarta, Kamis (20/12/2018). - Bisnis/Abdullah Azzam</div> </div>",bisnis, Kurs Rupiah Masih Menguat di 14.203,https://market.bisnis.com/read/20190122/93/881070/-kurs-rupiah-masih-menguat-di-14.203
23,"Bisnis.com, JAKARTA – Bank Indonesia mematok kurs tengah hari ini, Selasa (22/1/2019) di level Rp14.221 per dolar AS, melemah 9 poin atau 0,06% dari posisi Rp14.212 pada Senin (21/1).Kurs jual ditetapkan di Rp14.292 per dolar AS, sedangkan kurs beli berada di Rp14.150 per dolar AS. Selisih antara kurs jual dan kurs beli adalah Rp142.Adapun berdasarkan data Bloomberg, nilai tukar rupiah di pasar spot terpantau menguat 25 poin atau 0,18% ke level Rp14.202 per dolar AS pada pukul 11.15 WIB. Sepanjang perdagangan hari ini, rupiah bergerak di kisaran Rp14.185-Rp14.228 per dolar AS.Nilai tukar rupiah terhadap dolar Amerika Serikat (AS) mulai rebound dari pelemahannya ketika dibuka terapresiasi 18 poin atau 0,13% di level Rp14.209 per dolar AS dari level penutupan perdagangan sebelumnya.Pada perdagangan Senin (21/1), nilai tukar rupiah ditutup terdepresiasi 49 poin atau 0,35% di level Rp14.227 per dolar AS.Selain rupiah, hanya mata uang yen Jepang yang terapresiasi terhadap dolar AS. Sebaliknya, mata uang lainnya di Asia terpantau melemah terhadap dolar AS siang ini, dipimpin ringgit Malaysia yang terdepresiasi 0,47%.Sementara itu, indeks dolar Amerika Serikat (AS) yang mengukur kekuatan mata uang dolar AS terhadap sejumlah mata uang utama dunia, terpantau menguat 0,044 poin atau 0,05% ke level 96,380 pada pukul 11.08 WIB.Pergerakan indeks dolar sebelumnya dibuka naik hanya 0,001 poin di level 96,337 pagi tadi, setelah berakhir flat di posisi 96,336 pada perdagangan Senin (21/1).Dilansir dari Bloomberg, mayoritas mata uang dan indeks saham di Asia bergerak ke posisi lebih rendah pada perdagangan hari ini, setelah Dana Moneter Internasional (IMF) memangkas proyeksi pertumbuhan global. Hal ini menambah kekhawatiran yang semakin dalam atas dampak dari konlfik perdagangan AS dan China.Berdasarkan laporan World Economic Outlook (WEO) Januari 2019, IMF memperkirakan PDB ekonomi global akan tumbuh 3,5% pada 2019 dan3,6% pada 2020. Angka tersebut lebih rendah masing-masing 0,2% dan 0,1% dari WEO Oktober 2018. Pertumbuhan tersebut juga lebih lambat jika dibandingkan dengan estimasi pertumbuhan ekonomi pada 2018 sebesar 3,7%.Dalam laporan yang dirilis pada Senin (21/1), IMF menyebutkan revisi turun itu melihat adanya dampak negatif dari kenaikan tarif perdagangan antara Amerika Serikat dan China yang menyebabkan perekonomian Negeri Panda berpotensi melambat lebih besar dari ekspektasi.Selain ketegangan perdagangan, potensi no-deal Brexit atau keluarnya Inggris dari Uni Eropa tanpa kesepakatan ikut menjadi sentimen pemberat perekonomian tahun ini.Menurut Brown Brothers Harriman, mata uang pasar negara berkembang tetap berada di bawah tekanan karena dolar AS tetap tangguh.“Saat prospek suku bunga AS yang lebih kecil menguntungkan emerging market, kami rasa hal ini diimbangi dengan memburuknya prospek pertumbuhan global,” ujar kepala global strategi mata uang Win Thin dalam risetnya.Kurs Transaksi Bank Indonesia (Rupiah)22 Januari14.22121 Januari14.21218 Januari14.18217 Januari14.15816 Januari14.154Sumber: Bank Indonesia",21+January+2019,8,"<div class=""main-image""> <a href=""#"" title=""""> <img alt="""" src=""https://img.bisnis.com/posts/2019/01/22/881122/kurs-bisnis.jpg""/> </a> <div class=""caption"">Ilustrasi - Bisnis</div> </div>",bisnis,"Kurs Tengah Melemah 9 Poin, Rupiah Unjuk Gigi Saat Mayoritas Mata Uang Asia Tertekan",https://market.bisnis.com/read/20190122/93/881122/kurs-tengah-melemah-9-poin-rupiah-unjuk-gigi-saat-mayoritas-mata-uang-asia-tertekan
24,"Harga emas Comex tampak bergerak fluktuatif seiring dengan pergerakan dolar Amerika Serikat (AS) pada perdagangan pagi Senin (21/1/2019).Berdasarkan data Bloomberg, harga emas Comex kontrak Februari 2019 dibuka melemah 0,15% atau 1,90 poin di level US$1.280,70 per troy ounce. Baca selengkapnya di siniPT Adaro Energy Tbk. (ADRO) sedang mengembangkan dua proyek pembangkit melalui anak usahanya PT Adaro Power, yakni PLTU Tanjung Power Indonesia (TPI) berkapasitas 2x100 MW dan PLTU Bhimasena Power Indonesia (BPI) berdaya 2x1000 MW.Wakil Presiden Direktur Adaro Power Dharma Djojonegoro menyampaikan, PLTU TPI terletak di Kabupaten Tanjung, Kalimantan Selatan. Nilai investasinya mencapai US$545 juta. Baca selengkapnya di sini.di siniPT Mitra Pinasthika Mustika Tbk. mengaku berhasil mencatatkan kinerja yang cukup baik di sepanjang tahun lalu.GM Corporate Communication Mitra Pinasthika Mustika Natalia Lusnita mengatakan, berdasarkan hasil segmen bisnis kendaraan roda dua yang dijalankan oleh MPMulia, penjualan secara year-to-date (ytd) pada periode Januari—September 2018 tercatat meningkat sebesar 5% dibandingkan periode yang sama pada tahun sebelumnya. baca selengkapnya di sini.Harga karet di bursa Tokyo berhasil memperpanjang penguatannya pada perdagangan hari keempat berturut-turut, Senin (21/1/2019)Berdasarkan data Bloomberg, harga karet untuk kontrak teraktif Juni 2019 di Tokyo Commodity Exchange (Tocom), ditutup menguat 2,58%, baca selengkapnya di siniDolar AS melayang di dekat level tertinggi 2 minggu terhadap mata uang lainnya pada Selasa (22/1/2019).Hal ini karena perlambatan ekonomi China ke posisi terendah 28-tahun menghidupkan kembali kekhawatiran investor atas pertumbuhan global, sehingga mendukung mata uang safe haven. Baca selengkapnya di sini",21+January+2019,9,"<div class=""main-image""> <a href=""#"" title=""""> <img alt="""" src=""https://img.bisnis.com/posts/2019/01/22/881113/emas1.jpg""/> </a> <div class=""caption"">Harga emas berjangka naik di Divisi COMEX New York Mercantile Exchange. / Antara</div> </div>",bisnis,"5 Berita Populer Market, Adaro Siap Jalankan Mega Proyek, Dolar AS Terdongkrak Kekhawatiran Pertumbuhan Ekonomi Global",https://market.bisnis.com/read/20190122/235/881113/5-berita-populer-market-adaro-siap-jalankan-mega-proyek
25,"Bisnis.com, JAKARTA - Kurs rupiah menyentuh posisi Rp14.221 per dolar AS berdasarkan kurs referensi Jakarta Interbank Spot Dollar Rate (Jisdor) hari ini, Selasa (22/1/2019).Data yang diterbitkan Bank Indonesia pagi ini menempatkan kurs referensi Jisdor di level Rp14.221 per dolar AS, melemah tipis 9 poin atau 0,06% dari posisi Rp14.212 pada Senin (21/1).Meski demikian, berdasarkan data Bloomberg, nilai tukar rupiah di pasar spot menguat 29 poin atau 0,20% ke level Rp14.198 per dolar AS pada pukul 10.33 WIB. Sepanjang perdagangan hari ini, rupiah bergerak di kisaran Rp14.198-Rp14.228 per dolar AS.Nilai tukar rupiah terhadap dolar Amerika Serikat (AS) mulai rebound dari pelemahannya ketika dibuka terapresiasi 18 poin atau 0,13% di level Rp14.209 per dolar AS dari level penutupan perdagangan sebelumnya.Pada perdagangan Senin (21/1), nilai tukar rupiah ditutup terdepresiasi 49 poin atau 0,35% di level Rp14.227 per dolar AS.Sementara itu, pergerakan indeks dolar Amerika Serikat (AS) yang mengukur kekuatan mata uang dolar AS terhadap sejumlah mata uang utama dunia, terpantau turun tipis 0,022 poin atau 0,02% ke level 96,314 pada pukul 10.24 WIB.Indeks dolar tergelincir ke zona merah setelah dibuka naik hanya 0,001 poin di level 96,337. Adapun pada perdagangan Senin (21/1) indeks dolar berakhir flat di posisi 96,336.Namun pada dasarnya dolar AS tetap bergerak di kisaran level tertingginya dalam 2 pekan terhadap sejumlah mata uang utama, setelah perlambatan ekonomi China ke posisi terendah 28 tahun membangkitkan kembali kekhawatiran investor atas pertumbuhan global, sehingga mendukung mata uang safe haven.Semalam, Dana Moneter Internasional (IMF) memangkas perkiraan pertumbuhan global 2019 dan 2020, mengutip perlambatan yang lebih besar dari yang diperkirakan di China dan Zona Euro. Selain itu, kegagalan untuk menyelesaikan ketegangan perdagangan dapat semakin mengganggu kestabilan ekonomi global.Kekhawatiran tersebut muncul ketika Laporan Biro Statistik Nasional China (NBS) pada Senin (21/1/2019) mengungkapkan produk domestik bruto (PDB) China naik 6,4% pada kuartal IV/2018 dari tahun sebelumnya.Pertumbuhan itu menjadi laju paling lamban sejak krisis keuangan 2009, juga lebih rendah dari pertumbuhan sebesar 6,5% pada kuartal sebelumnya.Sepanjang tahun 2018, pertumbuhan ekonomi China memperlihatkan kondisi perlambatan yang sama dengan pada 1990. Biro Statistik Nasional China mengumumkan ekonomi China tumbuh 6,6% secara tahunan sepanjang 2018.Kurs Referensi Jakarta Interbank Spot Dollar Rate (Jisdor/Rupiah)22 Januari14.22121 Januari14.21218 Januari14.18217 Januari14.15816 Januari14.154Sumber: Bank Indonesia",21+January+2019,10,"<div class=""main-image""> <a href=""#"" title=""""> <img alt="""" src=""https://img.bisnis.com/posts/2019/01/22/881111/010718-zam-bisnis-18-bank-rupiah-1_8006.jpg""/> </a> <div class=""caption"">Karyawan memperlihatkan mata uang rupiah di salah satu bank di Jakarta. - JIIBI/Abdullah Azzam</div> </div>",bisnis,"Kurs Jisdor Melemah ke Rp14.221, Rupiah Rebound di Pasar Spot",https://market.bisnis.com/read/20190122/93/881111/kurs-jisdor-melemah-ke-rp14.221-rupiah-rebound-di-pasar-spot
26,"Bisnis.com, JAKARTA – Pergerakan indeks harga saham syariah, Jakarta Islamic Index (JII), berbalik melemah pada perdagangan pagi ini, Selasa (22/1/2019), bersama dengan IHSG.JII melemah 0,42% atau 3,07 poin ke level 720,73 pada pukul 10.17 WIB, setelah dibuka dengan kenaikan tipis 0,04% atau 0,28 poin di posisi 724,08.JII kembali bergerak di zona merah untuk hari kedua setelah ditutup terkoreksi 0,31% atau 2,28 poin di level 723,80 pada perdagangan Senin (21/1).Sepanjang perdagangan pagi ini, JII bergerak di level 719,25-725,14.Sebanyak 10 saham menguat, 18 saham melemah, dan 2 saham stagnan dari 30 saham syariah yang diperdagangkan.Saham PT Telekomunikasi Indonesia (Persero) Tbk. (TLKM) dan PT Astra International Tbk. (ASII) yang masing-masing turun 1,49% dan 0,90% menjadi penekan utama terhadap pelemahan JII pagi ini.Sementara itu, Indeks Harga Saham Gabungan (IHSG) tergelincir dari reli penguatannya pada perdagangan pagi ini.Pada pukul 10.18 WIB, IHSG menyentuh level 6.431,21 setelah melemah 0,30% atau 19,62 poin dari level penutupan Senin (21/1) di level 6.450,83 dengan penguatan 0,04% atau 2,68 poin.Sepanjang perdagangan pagi ini, IHSG bergerak di level 6.420,47 – 6.464,53.Saham PT Bank Central Asia Tbk. (BBCA) dan PT Telekomunikasi Indonesia Tbk. (TLKM) yang turun 1,08% dan 1,49% masing-masing menjadi penekan utama terhadap pelemahan IHSG pada pukul 10.18 WIB.Saham-saham syariah yang melemah pagi ini:TLKM-1,49%ASII-0,90%UNTR-1,86%ADRO-2,72%Saham-saham syariah yang menguat pagi ini:UNVR+0,62%+1,72%+1,39%+2,79%Sumber: Bloomberg",21+January+2019,11,"<div class=""main-image""> <a href=""#"" title=""""> <img alt="""" src=""https://img.bisnis.com/posts/2019/01/22/881106/jii-syariahindex-copy.jpg""/> </a> <div class=""caption""></div> </div>",bisnis,"Ikuti IHSG, Indeks Syariah Berbalik Melemah di Awal Dagang",https://market.bisnis.com/read/20190122/7/881106/ikuti-ihsg-indeks-syariah-berbalik-melemah-di-awal-dagang
