,content,date,id,images,sumber,title,url
27,"Bisnis.com, JAKARTA -- MNC Sekuritas memperkirakan penawaran investor terhadap Surat Berharga Syariah Negara atau Sukuk Negara akan berkisar antara Rp15 triliun-Rp25 triliun dalam lelang yang digelar pada Selasa (22/1/2019).Hari ini, akan ada lima seri sukuk yang dilelang, yakni seri SPN-S 09072019 (Reopening), SPN-S 23012020 (New Issuance), PBS014 (Reopening), PBS019 (Reopening), dan PBS022 (New Issuance). Target penerbitan lelang kali ini adalah senilai Rp8 triliun.Berikut profil masing-masing seri yang dilelang:Surat Perbendaharaan Negara seri SPN-S 09072019 (Diskonto; 9 Juli 2019);Surat Perbendaharaan Negara seri SPN-S 23012020 (Diskonto; 23 Januari 2020)Project Based Sukuk Seri PBS014 (6,500%; 15 Mei 2021);Project Based Sukuk Seri PBS019 (8,250%; 15 September 2023); danProject Based Sukuk Seri PBS022 (imbalan tetap; 15 April 2034).""Kami perkirakan jumlah penawaran yang masuk berkisar antara Rp15 triliun-Rp25 triliun dengan jumlah penawaran terbesar masih akan didapati pada Surat Perbendaharaan Negara serta pada PBS014,"" kata Kepala Divisi Riset Fixed Income MNC Sekuritas I Made Adi Saputra, dalam riset harian, Selasa (22/1).Berdasarkan kondisi di pasar sekunder menjelang pelaksanaan lelang, dia memperkirakan tingkat imbal hasil yang akan dimenangkan pada lelang hari ini adalah sebagai berikut :Surat Perbendaharaan Negara seri SPN-S 09072019 berkisar antara 6,40625 - 6,50000;Surat Perbendaharaan Negara seri SPN-S 23012020 berkisar antara 6,71875 - 6,81250;Project Based Sukuk seri PBS014 berkisar antara 7,96875 - 8,06250;Project Based Sukuk seri PBS019 berkisar antara 8,34375 - 8,43750; danProject Based Sukuk seri PBS022 berkisar antara 8,65625 - 8,75000 dengan tingkat imbalan sebesar 8,625%Lelang akan dibuka pada pukul 10.00 WIB dan ditutup pukul 12.00 WIB. Hasil lelang akan diumumkan pada hari yang sama.Adapun setelmen akan dilaksanakan pada Kamis (24/1) atau 2 hari kerja setelah tanggal pelaksanaan lelang (T+2).Pada 2019, target penerbitan bersih (net issuance) Surat Berharga Negara (SBN) ditetapkan sebesar Rp389 triliun. Pada kuartal I/2019, pemerintah membidik penerbitan SBN melalui lelang senilai Rp185 triliun dari 7 kali lelang Surat Utang Negara (SUN) dan 6 kali lelang Sukuk Negara.Pada lelang sebelumnya, pemerintah meraup dana senilai Rp8,65 triliun dari total penawaran yang masuk senilai Rp17,81 triliun.",21+January+2019,12,"<div class=""main-image""> <a href=""#"" title=""""> <img alt="""" src=""https://img.bisnis.com/posts/2019/01/22/881107/surat-utang-negara-sun-ilustrasi-bisniscom--.jpg""/> </a> <div class=""caption"">Ilustrasi Surat Utang Negara. - Bisnis.com</div> </div>",bisnis,MNC Sekuritas: Minat Lelang Sukuk Diperkirakan Capai Rp25 Triliun,https://market.bisnis.com/read/20190122/92/881107/mnc-sekuritas-minat-lelang-sukuk-diperkirakan-capai-rp25-triliun
28,"Bisnis.com, JAKARTA – Sektor infrastruktur melorot dan memimpin mayoritas sektor menekan pergerakan Indeks Harga Saham Gabungan (IHSG) pada perdagangan pagi ini, Selasa (22/1/2019).Berdasarkan data Bloomberg, IHSG berbalik turun 0,10% atau 6,49 poin ke level 6.444,34 pada pukul 09.35 WIB, setelah dibuka dengan kenaikan tipis 0,03% atau 1,77 poin di posisi 6.452,60.Lima dari sembilan sektor bergerak di zona merah, dipimpin sektor pertanian dan tambang yang masing-masing turun 1,16% dan 0,88%. Empat sektor lainnya bergerak di zona hijau, dipimpin sektor konsumer yang naik 0,50%.Pergerakan IHSG kemudian terpantau melemah 0,38% atau 24,72 poin ke level 6.426,11 pada pukul 09.53 WIB dari level penutupan pada Senin (21/1) di posisi 6.450,83.Sepanjang perdagangan pagi ini, IHSG bergerak di level 6.424,77 – 6.464,77.Sektor infrastruktur melorot 1,27% sekaligus memimpin pergerakan delapan sektor di zona merah. Pelemahannya diikuti sektor tambang dan pertanian yang masing-masing turun 1,27% dan 1,26%.Meski demikian, sektor konsumer masih bertahan bergerak di zona hijau dengan kenaikan 0,48% sekaligus membatasi koreksi yang dialami IHSG pagi ini.Sementara itu, sebanyak 147 saham bergerak menguat, 173 saham bergerak melemah, dan 307 saham stagnan dari 627 saham yang terdaftar di Bursa Efek Indonesia.Saham BBCA(-1,17%), TLKM (-1,49%), BBRI (-0,79%), dan PADI (-16,30%) menjadi penekan utama atas pelemahan IHSG pada pukul 09.53 WIB.Pergerakan Sektor IHSG Pukul 09.53 WIBSektorPerubahanInfrastruktur-1,27%Tambang-1,26%Pertanian-1,06%Aneka industri-0,50%Properti-0,47%Finansial-0,46%Industri dasar-0,16%Perdagangan-0,10%Konsumer+0,48%Sumber: Bloomberg",21+January+2019,13,"<div class=""main-image""> <a href=""#"" title=""""> <img alt="""" src=""https://img.bisnis.com/posts/2019/01/22/881100/emsaham080119-3.jpg""/> </a> <div class=""caption"">Karyawan memantau pergerakan Indeks harga saham gabungan (IHSG) di salah satu perusahaan manajer investasi, di Jakarta, Selasa (8/1/2019). - Bisnis/Endang Muchtar</div> </div>",bisnis,Infrastruktur Pimpin Mayoritas Sektor Tekan Laju IHSG ,https://market.bisnis.com/read/20190122/7/881100/infrastruktur-pimpin-mayoritas-sektor-tekan-laju-ihsg-
29,"Bisnis.com, JAKARTA -- MNC Sekuritas memperkirakan harga Surat Utang Negara (SUN) masih berpotensi mengalami penurunan pada perdagangan Selasa (22/1/2019), di tengah meningkatnya persepsi risiko terhadap instrumen surat utang negara-negara berkembang. ""Namun, kami melihat penurunan harga tersebut akan mulai terbatas, didukung oleh hasil positif dari lelang penjualan SUN,"" kata Kepala Divisi Riset Fixed Income MNC Sekuritas I Made Adi Saputra, dalam riset harian, Selasa (22/1). Dia memperkirakan pergerakan harga SUN hari ini akan lebih banyak dipengaruhi oleh faktor eksternal. Dengan harga SUN yang masih berpeluang naik, terutama untuk tenor di atas 7 tahun, Made menyarankan investor untuk mencermati beberapa seri SUN melakukan strategi trading untuk memanfaatkan momentum kenaikan harga tersebut. Beberapa seri SUN yang perlu dicermati adalah FR0069, FR0053, FR0061, FR0070, FR0057, dan FR0065. Pada perdagangan Senin (21/1), imbal hasil bergerak dengan kecenderungan naik di tengah kembali melemahnya rupiah. Yield SUN tenor pendek naik rata-rata 3 bps, didorong perubahan harga rata-rata sebesar 8,3 bps.Untuk SUN tenor menengah, imbal hasilnya naik 1 bps dengan didorong perubahan harga 4,4 bps. Sementara itu, SUN tenor panjang, lebih dari 7 tahun, pergerakan tingkat imbal hasilnya rata-rata 2 bps yang didorong perubahan harga rata-rata hingga 19,6 bps. Untuk SUN seri acuan, kenaikannya relatif terbatas hingga 1,2 bps di tengah terbatasnya perubahan harga di pasar sekunder.Pelemahan rupiah yang mendorong pergerakan yield ini dipengaruhi oleh perlambatan pertumbuhan ekonomi China. Data makro Negeri Panda menunjukkan adanya perlambatan ekonomi, dari 6,5% menjadi 6,4%, dan tingkat pengangguran yang meningkat menjadi 4,9%.Data tersebut membuat para pelaku pasar lebih tertarik kepada dolar AS ketimbang yuan China dan berdampak terhadap perdagangan global.Adapun dari domestik, Pemerintah Indonesia berencana menaikkan pajak impor untuk membantu mempersempit defisit neraca perdagangan.Di sisi lain, untuk SUN berdenominasi dolar AS, pergerakan harganya relatif terbatas di tengah kembali turunnya persepsi risiko yang tercermin pada penurunan angka Credit Default Swap (CDS). Perubahan harga juga didorong oleh relatif stabilnya pergerakan imbal hasil US Treasury.  Perubahan harga yang terbatas pada perdagangan kemarin berdampak terhadap terbatasnya perubahan tingkat imbal hasilnya.  Harga INDO24 berada di level 108,338%, yang berdampak pada tingkat imbal hasil sebesar 4,012%. Untuk INDO29 dan INDO44, harganya masing-masing berada di level 103,181% dan 123,477% sehingga berdampak pada tingkat imbal hasil masing-masing sebesar 4,356% dan 5,080%. Pada perdagangan kemarin, volume perdagangan Surat Utang Negara (SUN) adalah senilai Rp6,96 triliun dari 33 seri yang diperdagangka. Volume perdagangan terbesar tercatat pada seri FR0077 yaitu sebesar Rp1,29 triliun dari 31 kali transaksi, diikuti seri FR0068 dengan volume Rp1,207 triliun dari 68 kali transaksi.  Untuk Sukuk Negara, Project Based Sukuk seri PBS013 menduduki volume perdagangan tertinggi dengan volume Rp535,00 miliar dari 8 kali transaksi. Diikuti seri SR008 dan SR009 yang volumenya masing-masing sebesar Rp266,65 miliar dari 11 kali transaksi dan Rp58,33 miliar dari 15 kali transaksi. Adapun volume perdagangan obligasi korporasi yang dilaporkan pada perdagangan kemarin senilai Rp385,03 miliar dari 28 seri yang diperdagangkan.  Obligasi Subordinasi Berkelanjutan II Bank PANIN Tahap II Tahun 2017 (PNBN02SBCN2) menjadi surat utang korporasi dengan volume perdagangan terbesar, yakni senilai Rp46 miliar dari 9 kali transaksi. Diikuti Obligasi Berkelanjutan I Bank Mandiri Tahap III Tahun 2018 (BMRI01CN3) senilai Rp45 miliar dari 3 kali transaksi.  Sementara itu, rupiah ditutup melemah 49,00 pts (0,35%) ke level Rp14.226,5 per dolar AS. Pelemahan tersebut terjadi di tengah melemahnya nilai tukar mata uang regional.Mata uang peso Filipina (PHP) dan mata uang won Korea Selatan (KRW) merupakan mata uang yang mengalami koreksi terbesar, keduanya melemah sebesar 0,55% terhadap dolar AS. Yuan China (CNY) dan baht Thailand (THB) mengalami pelemahan masing-masing 0,27% dan 0,25%. Adapun yen Jepang (JPY) merupakan satu-satunya yang mengalami penguatan di regional, yaitu sebesar 0,11%. Imbal hasil US Treasury bertenor 10 tahun ditutup melemah terbatas di level 2,777%, sedangkan yield US Treasury dengan tenor 30 tahun menguat di level 3,098%. Hal ini seiring dengan menguatnya pasar saham AS, di mana indeks saham utamanya mengalami penguatan 138 bps di level 24706,35 (DJIA) dan indeks NASDAQ berada di level 7157,23.  Adapun imbal hasil surat utang Inggris bertenor 10 tahun berada di level 1,324% dan surat utang Jerman tenor 10 tahun mengalami penurunan ke level 0,256%.",21+January+2019,14,"<div class=""main-image""> <a href=""#"" title=""""> <img alt="""" src=""https://img.bisnis.com/posts/2019/01/22/881103/sbr005-100119.jpg""/> </a> <div class=""caption"">Direktur Surat Utang Negara (SUN) pada Ditjen Pengelolaan Pembiayaan dan Resiko Kemenkeu Loto S. Ginting memperlihatkan informasi tentang Savings Bond Ritel (SBR) seri SBR005 ketika peluncuran di Jakarta, Kamis (10/1/2019). - ANTARA/Wahyu Putro A</div> </div>",bisnis,MNC Sekuritas: Persepsi Risiko Pasar SUN Meningkat,https://market.bisnis.com/read/20190122/92/881103/mnc-sekuritas-persepsi-risiko-pasar-sun-meningkat
30,"Bisnis.com, JAKARTA -- Mirae Asset Sekuritas Indonesia memperkirakan harga Surat Utang Negara (SUN) di pasar sekunder berpeluang menguat terbatas pada perdagangan Selasa (22/1/2019).Analis Fixed Income Mirae Asset Sekuritas Indonesia Dhian Karyantono mengatakan minimnya rilis data ekonomi AS dan tutupnya bursa AS, membuat investor global fokus pada perkembangan Brexit.Terkait Brexit, Perdana Menteri (PM) Inggris Theresa May telah mengajukan rencana cadangan (Plan B) guna menghindari no deal Brexit atau hard Brexit meski sejauh ini belum ada tanda bahwa rencana tersebut akan mendapat persetujuan dari Parlemen Inggris.Namun, ada indikasi ekspektasi positif oleh pasar merespons rencana cadangan tersebut. Hal ini tercermin dari apresiasi poundsterling sebesar 0,13% ke level 0,757 pounds terhadap dolar AS , sedangkan yield UK Gilt tenor 10 tahun turun ke level 1,32% dibandingkan dengan akhir pekan lalu di level 1,35%.Kondisi tersebut berpotensi mendorong turunnya indeks dolar AS dan yield US Treasury hari ini, sehingga pada akhirnya bisa menjadi katalis positif bagi pergerakan rupiah dan imbal hasil SUN.Di sisi lain, tren kenaikan harga minyak mentah dunia dan dampak lanjutan dari melambatnya ekonomi China bisa menjadi faktor yang membatasi proyeksi menguatnya harga SUN pada hari ini.Harga minyak mentah dunia yang merupakan sinyal awal kenaikan yield US Treasury, yang pada akhirnya berpotensi mendorong imbal hasil SUN, sejauh ini berada pada kisaran US$53,93 per barel untuk kategori WTI atau tertinggi sejak pertengahan November 2018.Sementara itu, menguatnya harga SUN melalui transmisi apresiasi rupiah berpotensi dibatasi oleh proyeksi depresiasi yuan terhadap dolar AS sebagai respons lanjutan terhadap melambatnya ekonomi China.""Didasarkan pada proyeksi kenaikan terbatas harga SUN hari ini, proyeksi berlanjutnya keadaan yang sama di perdagangan esok hari, masih menariknya yield yang ditawarkan, dan masih tingginya risiko ekonomi global, kami merekomendasikan investor untuk fokus pada perdagangan seri-seri likuid, utamanya benchmark seperti seri FR0077, FR0078, FR0068, dan FR0079,"" papar Dhian dalam riset harian, Selasa (22/1).Berikut proyeksi rentang pergerakan harga dan imbal hasil seri-seri SUN yang likuid, hari ini:FR0063 (15 Mei 2023): 91,75 (7,92%) - 92,10 (7,81%)FR0077 (15 Mei 2024): 100,50 (8,00%) - 101,00 (7,89%)FR0064 (15 Mei 2028): 86,25 (8,27%) - 86,75 (8,18%)FR0078 (15 Mei 2029): 101,20 (8,07%) - 101,90 (7,97%)FR0065 (15 Mei 2033): 84,20 (8,56%) - 84,70 (8,49%)FR0068 (15 Maret 2034): 99,00 (8,49%) - 99,60 (8,42%)FR0075 (15 Mei 2038): 90,50 (8,51%) - 90,90 (8,46%)FR0079 (15 April 2039): 98,50 (8,53%) - 99,10 (8,47%)Adapun rupiah diperkirakan masih bergerak fluktuatif di kisaran Rp14.173-Rp14.252.Berikut review perdagangan pada Senin (21/1):-PRICE OF INDONESIA GOVERNMENT BONDS-FR0077: -4,40 bps to 100,71 (7,96%)FR0078: -10,50 bps to 101,26 (8,06%)FR0068: -4,80 bps to 99,03 (8,49%)FR0079: +6,70 bps to 98,47 (8,53%)-YIELD OF GLOBAL BONDS-UST 2yr: 0,000 point to 2,62%UST 5yr: 0,000 point to 2,62%UST 10yr: 0,000 point to 2,79%UST 30yr: 0,000 point to 3,10%German Bund 10yr: -0,007 point to 0,25%UK Gilt 10yr: -0,029 point to 1,32%-CDS OF INDONESIA BONDS-CDS 2yr: -0,25% to 51,92 CDS 5yr: +0,21% to 123,23CDS10yr: -0,85% to 198,17",21+January+2019,15,"<div class=""main-image""> <a href=""#"" title=""""> <img alt="""" src=""https://img.bisnis.com/posts/2019/01/22/881098/130612_sunok.jpg""/> </a> <div class=""caption"">Ilustrasi Surat Utang Negara</div> </div>",bisnis,Mirae Asset Sekuritas: Harga SUN Masih Menarik,https://market.bisnis.com/read/20190122/92/881098/mirae-asset-sekuritas-harga-sun-masih-menarik
31,"Bisnis.com, JAKARTA -- Bursa Efek Indonesia membuka perdagangan saham PT Bank Danamon Indonesia Tbk. (BDMN) dan PT Bank Nusantara Parahyangan Tbk. (BBNP) di seluruh pasar, terhitung sejak sesi pertama perdagangan efek, Selasa (22/1/2019).Pada Senin (21/1), bursa melakukan suspensi atas saham BDMN dan BBNP.Pembukaan kembali perdagangan saham BDMN dan BBNP dilakukan setelah kedua bank itu mengumumkan keterbukaan informasi yang perlu diketahui publik tentang rencana penggabungan usaha kedua perseroan yang disampaikan pada hari ini.""... dengan ini kami sampaikan bahwa Bursa memutuskan untuk melakukan pembukaan perdagangan efek PT Bank Danamon Indonesia Tbk. (BDMN) dan PT Bank Nusantara Parahyangan Tbk. (BBNP) di seluruh Pasar, terhitung sejak sesi I Perdagangan Efek pada hari Selasa, tanggal 22 Januari 2019,"" ungkap manajemen BEI dalam keterbukaan informasi, Selasa (22/1).Bursa meminta kepada para pemangku kepentingan untuk tetap memperhatikan setiap keterbukaan informasi yang disampaikan oleh perseroan.Pada perdagangan hari ini, saham BDMN dibuka menguat di level Rp8.600 atau naik 3% dibandingkan penutupan akhir pekan lalu, yang berada di level Rp8.350. Saham BDMN terpantau terus naik dan menyentuh lebih dari 7% pada perdagangan pagi ini.Sementara itu, saham BBNP belum bergerak, masih di level Rp2.200.Dalam keterbukaan informasi pada Jumat (18/1), BDMN menyampaikan laporan informasi atau fakta material terkait rencana penggabungan usaha antara perseroan dengan Bank Nusantara Parahyangan. Bank Danamon menyatakan kedua pihak memiliki pemegang saham pengendali yang sama, yaitu secara langsung dan tidak langsung MUFG Bank Ltd.Aksi korporasi ini diakui dapat mempengaruhi harga efek BDMN di BEI dan/atau keputusan pemodal, calon pemodal, atau pihak lain yang berkepentingan atas informasi atau fakta tersebut.""Rencana penggabungan usaha saat ini masih dalam proses penelaahan antara Bank Danamon dan Bank Nusantara Parahyangan. Para pihak diminta berhati-hati dalam melakukan perdagangan saham,"" demikian pernyataan resmi Bank Danamon.Dalam keterbukaan informasi terpisah di laman resmi BEI pada hari yang sama, Bank Nusantara Parahyangan mengumumkan hal senada.",21+January+2019,16,"<div class=""main-image""> <a href=""#"" title=""""> <img alt="""" src=""https://img.bisnis.com/posts/2019/01/22/881096/nhsaham110119-1.jpeg""/> </a> <div class=""caption"">Karyawan berkomunikasi di dekat monitor informasi Indeks Harga Saham Gabungan (IHSG) di Bursa Efek Indonesia, Jakarta, Jumat (11/1/2019). - Bisnis/Nurul Hidayat</div> </div>",bisnis,"Bursa Buka Gembok Saham BDMN dan BBNP, Saham BDMN Naik 7%",https://market.bisnis.com/read/20190122/7/881096/bursa-buka-gembok-saham-bdmn-dan-bbnp-saham-bdmn-naik-7
32,"Bisnis.com, JAKARTA – Pergerakan Indeks Harga Saham Gabungan (IHSG) tergelincir ke zona merah pada awal perdagangan hari ini, Selasa (22/1/2019).Berdasarkan data Bloomberg, IHSG berbalik turun 0,10% atau 6,49 poin ke level 6.444,34 pada pukul 09.35 WIB, setelah dibuka dengan kenaikan tipis 0,03% atau 1,77 poin di posisi 6.452,60.Sepanjang perdagangan pagi ini, IHSG bergerak di level 6.443,04 – 6.464,53. Pada perdagangan Senin (21/1), pergerakan IHSG mampu berakhir menguat 0,04% atau 2,68 poin di level 6.450,83, kenaikan hari kelima beruntun.Lima dari sembilan sektor bergerak di zona merah, dipimpin sektor pertanian dan tambang yang masing-masing turun 1,16% dan 0,88%. Empat sektor lainnya bergerak di zona hijau, dipimpin sektor konsumer yang naik 0,50%.Sebanyak 168 saham menguat, 114 saham melemah, dan 345 saham stagnan dari 627 saham yang diperdagangkan.Saham PT Bank Rakyat Indonesia (Persero) Tbk. (BBRI) dam PT Telekomunikasi Indonesia (Persero) Tbk. (TLKM) yang masing-masing turun 1,05% dan 0,99% menjadi penekan utama terhadap pergerakan IHSG pagi ini.Di sisi lain, saham PT Bank Danamon Indonesia Tbk. (BDMN) dan PT Indofood CBP Sukses Makmur Tbk. (ICBP) yang masing-masing naik 6,59% dan 2,21% menjadi pendorong utama sekaligus membatasi koreksi IHSG.Pergerakan IHSG diproyeksikan berbalik melemah pada perdagangan hari ini. Analis Binaartha Sekuritas Muhammad Nafan Aji Gusta mengatakan terlihat pola shooting star candle yang mengindikasikan adanya potensi koreksi wajar pada pergerakan IHSG sehingga berpeluang menuju ke area support.Berdasarkan daily pivot dari Bloomberg, support pertama maupun kedua memiliki range pada 6.435,773 hingga 6.420x712. Sementara itu, resistance pertama maupun kedua memiliki range pada 6.469 022 hingga 6.487,210.“Berdasarkan indikator, MACD masih berada di area positif. Namun demikian, Stochastic dan RSI sudah menunjukkan overbought atau jenuh beli,” paparnya dalam riset.Sejalan dengan IHSG, pergerakan indeks Bisnis-27 berbalik turun 0,20% atau 1,15 poin ke level 578,09 pada pukul 09.35 WIB, setelah dibuka naik tipis 0,04% atau 0,23 poin di posisi 579,48.Indeks saham lainnya di kawasan Asia mayoritas juga bergerak negatif pagi ini, di antaranya indeks FTSE Straits Times Singapura (-0,21%) dan indeks FTSE Malay KLCI (-0,15%).Indeks Topix dan Nikkei Jepang masing-masing turun 0,25% dan 0,09%. Indeks Kospi Korea Selatan turun 0,41%, sedangkan indeks Shanghai Composite dan indeks CSI 300 China masing-masing melemah 0,51% dan 0,59%.",21+January+2019,17,"<div class=""main-image""> <a href=""#"" title=""""> <img alt="""" src=""https://img.bisnis.com/posts/2019/01/22/881091/nhsaham110119-2.jpeg""/> </a> <div class=""caption"">Karyawan berkomunikasi di dekat monitor informasi Indeks Harga Saham Gabungan (IHSG) di Bursa Efek Indonesia, Jakarta, Jumat (11/1/2019). - Bisnis/Nurul Hidayat</div> </div>",bisnis,"Jenuh Beli, IHSG Tergelincir dari Relinya Pada Awal Dagang",https://market.bisnis.com/read/20190122/7/881091/jenuh-beli-ihsg-tergelincir-dari-relinya-pada-awal-dagang
33,"Bisnis.com, JAKARTA – Berita mengenai rencana investasi emiten konstruksi pelat merah serta target penjualan PT Hartadinata Abadi Tbk. menjadi sorotan media nasional, Selasa (22/1/2019).Berikut rincian topik utama di sejumlah media nasional:BUMN Karya Ramai-Ramai Investasi TOD. Emiten konstruksi pelat merah telah menganggarkan belanja modal atau rencana investasi untuk menangkap peluang dari pengembangan bisnis transit oriented development pada 2019. (Bisnis Indonesia)UNTR Pangkas Target Penjualan Alat Berat. Emiten alat berat, pertambangan, dan jasa pertambangan, PT United Tractors Tbk. pada tahun ini memangkas target penjualan alat berat dari 4.900 unit menjadi 4.000 unit. (Bisnis Indonesia)HRTA Bidik Penjualan Rp3,4 Triliun. PT Hartadinata Abadi Tbk. mengincar penjualan sekitar Rp3,2 triliun—Rp3,4 triliun sepanjang 2019. Target tersebut tumbuh 10%—15% dibandingkan dengan realisasi penjualan pada tahun lalu. (Bisnis Indonesia)Incar Bisnis Baru, Capex ELSA Melesat. Untuk mendorong ekspansi usaha dan pertumbuhan pendapatan, PT Elnusa Tbk. meningkatkan anggaran belanja modal atau capital expenditure (capex) sebesar 20% menjadi Rp600 miliar pada 2019. (Bisnis Indonesia)Wika Kembali Tawarkan Perpetual Bond Rp1,4 Triliun. Wijaya Karya Tbk. (WIKA) kembali menawarkan obligasi tanpa jatuh tempo (perpetual bond) sebesar Rp1,4 triliun. Saat ini, penawaran awal (bookbuilding) surat utang tersebut masih berlangsung. (Investor Daily)KINO Memperkuat Segmen Konsumsi. PT Kino Indonesia Tbk. membuka tahun 2019 dengan akuisisi penuh atas saham PT Kino Food Indonesia. Selanjutnya, produsen Larutan Cap Kaki Tiga tersebut bakal memacu segmen bisnis makanan. (Kontan)",21+January+2019,18,"<div class=""main-image""> <a href=""#"" title=""""> <img alt="""" src=""https://img.bisnis.com/posts/2019/01/22/881082/bandaranyia141218-2.jpg""/> </a> <div class=""caption"">Alat berat dioperasikan untuk pembangunan konstruksi Bandara New Yogyakarta International Airport (NYIA) di Kulon Progo, DI Yogyakarta, Jumat (14/12/2018). - ANTARA/Andreas Fitri Atmoko</div> </div>",bisnis,"AKSI EMITEN 22 JANUARI: BUMN Karya Ramai-Ramai Investasi TOD, HRTA Bidik Penjualan Rp3,4 Triliun",https://market.bisnis.com/read/20190122/192/881082/aksi-emiten-22-januari-bumn-karya-ramai-ramai-investasi-tod-hrta-bidik-penjualan-rp34-triliun
34,"Bisnis.com, JAKARTA—Dolar AS melayang di dekat level tertinggi 2 minggu terhadap mata uang lainnya pada Selasa (22/1/2019) karena perlambatan ekonomi China ke posisi terendah 28-tahun menghidupkan kembali kekhawatiran investor atas pertumbuhan global, sehingga mendukung mata uang safe haven.Semalam, Dana Moneter Internasional (IMF) memangkas perkiraan pertumbuhan global 2019 dan 2020, mengutip perlambatan yang lebih besar dari yang diperkirakan di Cina dan Zona Euro. Selain itu, kegagalan untuk menyelesaikan ketegangan perdagangan dapat semakin mengganggu kestabilan ekonomi global.Ketakutan itu muncul pada hari Senin (21/1/2019), ketika data menunjukkan ekonomi China tumbuh pada laju paling lambat sejak 1990 tahun lalu dalam tanda yang tidak menyenangkan untuk 2019. Pendinginan pertumbuhan di ekonomi terbesar kedua di dunia itu telah mengeruk keuntungan bagi perusahaan. Indeks dolar (DXY), yang mengukur kekuatannya terhadap sekelompok enam mata uang utama, stabil di 96,33, bertahan dekat tertinggi 2 minggu di 96,43 yang dicapai pada hari Senin.Sementara yen (JPY), mata uang safe-haven lainnya, stabil terhadap dolar, mengambil 109,64 pada awal perdagangan.Secara keseluruhan, dolar juga menghadapi tekanan tidak langsung dari momentum yang melambat dalam ekonomi global yang telah memaksa Federal Reserve AS untuk mengambil pendekatan yang hati-hati terhadap kenaikan suku bunga lebih lanjut. Spekulasi tersebar luas bahwa The Fed akan segera menghentikan siklus pengetatannya.“Kami tidak melihat Federal Reserve menaikkan suku tahun ini yang seharusnya mengarah pada pelemahan dolar. Kami juga berpikir dolar overbought dan dinilai terlalu tinggi pada metrik fundamental, ”kata Jason Wong, ahli strategi pasar di BNZ Markets, seperti dikutip dari Reuters, Selasa (22/1/2019).Sterling (GBP) adalah mata uang lain yang menghadapi ketidakpastian yang semakin tinggi karena Inggris bersiap untuk meninggalkan Uni Eropa pada 29 Maret 2019, tanpa ada tanda-tanda perjanjian permanen untuk mengamankan masa depan ekonomi Inggris dengan UE.Kesepakatan Brexit May ditolak mentah-mentah oleh parlemen minggu lalu dan pada hari Senin ia mengajukan proposal untuk mengatasi kebuntuan dengan mencari konsesi lebih lanjut dari UE mengenai rencana untuk mencegah pemeriksaan pabean di perbatasan Irlandia.""Dengan tenggat waktu yang semakin dekat dan apa yang tampaknya menjadi kebuntuan nyata antara berbagai pihak yang terlibat, prospek 'tidak ada kesepakatan' Brexit tampaknya menjadi lebih mungkin,"" kata Nick Twidale, chief operating officer di Rakuten Securities dalam sebuah catatan.Sumber : reuters",21+January+2019,19,"<div class=""main-image""> <a href=""#"" title=""""> <img alt="""" src=""https://img.bisnis.com/posts/2019/01/22/881074/070119zamrupiah-1.jpg""/> </a> <div class=""caption"">Karyawan menghitung mata uang rupiah dan dolar AS di Jakarta, Senin (1/7/2019). - Bisnis/Abdullah Azzam</div> </div>",bisnis,Kekhawatiran Pertumbuhan Global Dorong Dolar AS,https://market.bisnis.com/read/20190122/93/881074/kekhawatiran-pertumbuhan-global-dorong-dolar-as
