,content,date,id,images,sumber,title,url
0,"Bisnis.com, JAKARTA — PT Bank Mandiri (Persero) Tbk. berupaya menggenjot penyaluran kredit ke sektor pariwisata sebagai salah satu target ekspansi bisnis pada tahun ini.Senior Vice President Micro Development and Agent Banking Bank Mandiri Zedo Faly menuturkan bahwa perseroan telah melakukan pemetaan jaringan yang berada di  Kawasan Strategis Pariwisata (KSPN) sekaligus menjalin komunikasi ke berbagai pihak terkait.“Sebelum pemerintah memperkenalkan KUR Pariwisata di akhir 2018, Bank Mandiri sudah memiliki portofolio kredit ke sektor pariwisata,” ujarnya, Senin (21/1/2019).Hingga kuartal III/2018, bank pelat merah tersebut telah menyalurkan kredit pariwisata kepada  2.271 debitur senilai Rp163,4 miliar di 10 Destinasi Wisata Prioritas (DPP) yaitu Danau Toba, Tanjung Kelayang, Kepulaua Seribu, Tanjung Lesung, Borobudur, Bromo, dan Mandalika.Secara total, Zedo mengutarakan perseroan telah menyalurkan kredit pariwisata sejumlah Rp523,5 miliar kepada 7.240 debitur yang terebar di 88 KSPN Nasional hingga kuartal III/2018.Dalam kesempatan sebelumnya, Ketua Dewan Komisioner Otoritas Jasa Keuangan (OJK) Wimboh Santoso mengatakan otoritas akan fokus mendukung upaya pemerintah untuk mengakselerasi perkonomian nasional. Maka dari itu, lanjutnya, otoritas akan meningkatkan kontribusi pembiayaan pada sektor prioritas, salah satunya adalah ke sektor pariwisata.OJK akan mendorong prioritisasi program Kawasan Ekonomi Khusus Pariwisarta dengan cara pengembangan ekosistem, asuransi, dan penyaluran pembiayaan.",21+January+2019,0,"<div class=""main-image""> <a href=""#"" title=""""> <img alt="""" src=""https://img.bisnis.com/posts/2019/01/21/880989/130718_mandiri-logo.jpg""/> </a> <div class=""caption""></div> </div>",bisnis,Bank Mandiri Siapkan Pemetaan Jaringan di Kawasan Wisata Unggulan,https://finansial.bisnis.com/read/20190121/90/880989/bank-mandiri-siapkan-pemetaan-jaringan-di-kawasan-wisata-unggulan
1,"Bisnis.com, JAKARTA – Pelaku usaha menilai geliat teknologi finansial syariah pada 2019 menjadi pendongkrak paling aman bagi kemajuan usaha mikro kecil dan menengah.Ketua Asosiasi Usaha Mikro Kecil dan Menengah Indonesia Ikhsan Ingratubun mengatakan teknologi finansial Syariah adalah jalan terbaik bagi usaha mikro kecil menengah (UMKM) di Indonesia. Asalkan label syariah tersebut benar-benar diterapkan dalam praktik bisnisnya.""Teknologi finansial Syariah adalah jalan terbaik bagi usaha mikro di Indonesia. Saya harap praktiknya benar dan tidak hanya berkedok syariah padahal praktiknya sama dengan konvensional,"" katanya kepada Bisnis, Senin (21/1/2018).Dia menjelaskan, sistem syariah akan memberi kesempatan penyaluran dana yang lebih fleksibel dan bertanggung jawab kepada pelaku usaha mikro kecil dan menengah (UMKM).Dalam proses pengembaliannya, sistem syariah juga lebih menunjukkan toleransi lebih tinggi, karena lebih memahami bahwa sektor UMKM bukan sektor yang dapat digunakan hanya untuk mendapatkan untung, tetapi sektor yang perlu mendapat bimbingan lebih intensif.“Dengan begitu, penagihan yang dilakukan lewat tekfin syariah tidak menggunakan kata-kata kasar seperti tekfin konvensional kebanyakan,” katanya.Adapun, Sekretaris Jenderal Asosiasi Fintech Syariah Indonesia (AFSI) Luthfi Adiansyah mengatakan Indonesia memiliki 3 perusahaan teknologi finansial yang aktif, yakni Ammana, Dana Syariah, dan Investree Syariah, yang total penyaluran dananya bisa mencapai Rp100 miliar per tahun.Jika tahun ini 8 perusahaan baru bisa disetujui lagi oleh OJK maka pembiayaan hingga Rp200 miliar bisa terealisasi.""Yang sedang dalam proses pendaftaran ada 8 perusahaan. Kami harap tahun ini bisa beroperasi dan bisa membantu pelaku UMKM,"" katanya.Adapun, dia memaparkan, Ammana tekfin menargetkan pengembangan UMKM, dan bahkan lebih menyasar pelaku industri dengan pinjaman hingga Rp20 juta.Ammana tengah mengupayakan tahun ini mampu menyasar pelaku usaha kelas menengah dengan pinjaman bisa mencapai Rp300 juta.""Ammana mencoba menargetkan pelaku yang kelas menengah. Kami berharap dapat mencapai pembiayaan hingga Rp50 miliar dengan penerima manfaat 5.000 pelaku usaha,"" kata Luthfi yang juga menjabat sebagai Direktur Utama Ammana Fintech.Sementara itu, Investree Syariah juga fokus pada pengembangan pelaku usaha kelas menengah dengan metodenya invoice financing, dan pembiayaan berkisar antara Rp300 juta hingga Rp2 miliar.Invoice financing adalah pembiayaan menggunakan invoice belum terbayar yang dimiliki sebagai dokumen utama dalam aplikasi pinjaman.Berdasarkan catatan Bisnis, potensi tekfin baru yang beroperasi tahun ini cukup besar. Pasalnya, OJK memiliki 58 perusahaan peer-to-peer (P2P) lending yang sedang menjalani proses pendaftaran.Di luar itu, masih ada perusahaan yang berminat mendaftar 38 unit, sedangkan total perusahaan yang memiliki potensi mendaftarkan tekfinnya mencapai 244 unit badan usaha.",21+January+2019,1,"<div class=""main-image""> <a href=""#"" title=""""> <img alt="""" src=""https://img.bisnis.com/posts/2019/01/21/880991/ilustrasi-fintech-flickr-b.jpg""/> </a> <div class=""caption"">Ilustrasi teknologi finansial. - Flickr</div> </div>",bisnis,"Tekfin Syariah Cocok Bagi Bisnis UMKM, Begini Penjelasannya",https://finansial.bisnis.com/read/20190121/89/880991/tekfin-syariah-cocok-bagi-bisnis-umkm-begini-penjelasannya
2,"Bisnis.com, JAKARTA — PT Bank Danamon Indonesia Tbk. mengonfirmasi rencana penggabungan usaha dengan PT Bank Nusantara Parahyangan Tbk.Bank Danamon menyatakan, rencana penggabungan usaha dengan bank yang berpusat di Bandung tersebut akan dilakukan karena karena kedua perusahaan memiliki pemegang saham pengendali yang sama, yakni MUFG Bank Ltd.Dalam keterbukaan informasi yang ditandantangani oleh Sekretaris Perusahaan Bank Danamon Rita Mirasari tersebut, tertulis bahwa rencana penggabungan usaha atau merger masih dalam proses penelaahan antara kedua bank.“Rencana penggabungan usaha saat ini masih dalam proses penelahaan antara PT Bank Danamon Indonesia Tbk. dan PT Bank Nusantara Parahyangan Tbk.,” tertulis dalam keterbukaan informasi yang dipublikasikan pada Senin (21/1/2019).Berbeda dengan Danamon yang baru diakuisisi pada tahun lalu, BNP sudah diakuisisi bank yang berpusat di Tokyo, Jepang tersebut pada Desember 2007. MUFG mengakuisisi saham BNP melalui ACOM, Co. Ltd. sebesar 55,41% dan 20% melalui MUFG Bank.Per 30 September 2018 komposisi saham tersebut berubah menjadi 75,51%. ACOM kini menguasai 67,59% saham sedangkan MUFG Bank menguasai 7,91% dari seluruh saham yang diterbitkan oleh emiten perbankan berkode saham BBNP tersebut.Proses akuisisi Bank Danamon oleh MUFG Bank telah mencapai tahap kedua yakni pengambil alihan 40% saham dari total seluruh saham yang diterbitkan. MUFG Bank berencana menambah porsi kepemilikan saham di Bank Danamon hingga 73,8% melalui proses akuisisi tahap ketiga pada 2019.Sampai dengan kuartal III/2018 komposisi kepemilikan saham Bank Danamon tercatat sebesar 40% milik MUFG Bank. Adapun, 33,8% saham dimiliki oleh Asia Financial (Indonesia) Pte. Ltd., sedangkan 21,09% saham dimiliki publik. Sisa 5,08% saham dimiliki oleh JPMCB—Franklin Templeton Investment Funds.",21+January+2019,2,"<div class=""main-image""> <a href=""#"" title=""""> <img alt="""" src=""https://img.bisnis.com/posts/2019/01/21/880965/280417-zam-bisnis-18-danamon-8.jpg""/> </a> <div class=""caption"">Karyawan melayani nasabah di Kantor Cabang Bank Danamon, Jakarta, Jumat (28/4). - JIBI/Abdullah Azzam</div> </div>",bisnis,Bank Danamon Matangkan Rencana Merger dengan BNP,https://finansial.bisnis.com/read/20190121/90/880965/bank-danamon-matangkan-rencana-merger-dengan-bnp
3,"Bisnis.com, JAKARTA - PT Bank Mandiri (Persero) Tbk. bersama Mandiri Sekuritas dan Jefferies akan menggelar Mandiri Investment Forum (MIF) 2019. Forum tahunan ini akan mempertemukan investor dalam dan luar negeri guna mendorong peningkatan investasi di Tanah Air.Pada 2019, Mandiri Investment Forum yang bertajuk Indonesia: Invest Now! ini akan diikuti sekitar 600 investor dan pelaku bisnis dari dalam dan luar negeri, dan akan digelar pada 28 Januari hingga 1 Februari 2019 di Hotel Fairmont Jakarta.Head of Mandiri Institute Moekti Soejachmoen mengatakan, forum ini sangat penting untuk menciptakan sinergi antara investor, pelaku usaha dan pemangku kepentingan, agar mampu menangkap peluang investasi yang dapat mendukung upaya meningkatkan pertumbuhan ekonomi Indonesia.“Untuk mengakselerasi investasi, perlu sinergi seluruh pihak. Untuk itu, Bank Mandiri berkomitmen membantu memfasilitasi kebutuhan tersebut agar pertumbuhan ekonomi Indonesia yang baik dan berkelanjutan dapat dicapai,” kata Moekti Soejachmoen di Jakarta, Senin (21/1/2019).Pertumbuhan ekonomi Indonesia pada 2018 diperkirakan naik menjadi 5,17% dari 5,07% di tahun 2017. Dan tahun ini, Indonesia menargetkan pertumbuhan ekonomi sebesar 5.30%. Untuk mendukung hal tersebut, Pemerintah menargetkan pembangunan infrastruktur yang baik untuk mendukung konektivitas, seperti jalan, bandara, pelabuhan, rel kereta api, dermaga penyeberangan dan pembangkit listrik.”Perlu strategi dan dukungan semua pihak agar target pertumbuhan ekonomi Indonesia dapat terealisasi. Dasar itulah yang mendorong kami untuk mempertemukan investor dengan pemangku kepentingan agar pembangunan berjalan dengan baik,” ujar Tjandra Lienandjaja, Deputy Head of Equity Research Mandiri Sekuritas.Mandiri Investment Forum juga bertujuan untuk mendorong investasi yang merata di berbagai daerah. Kegiatan ini juga akan diisi dengan site visit ke sejumlah perusahaan di Jakarta dan Yogyakarta yang berfokus kepada sektor ekonomi kreatif dan pariwisata.Kemudian, pada 30 Januari 2019, akan dilakukan diskusi yang akan dihadiri Gubernur Bank Indonesia Perry Warjiyo, Menteri Keuangan Sri Mulyani, Gubernur Jawa Barat Ridwan Kamil, Chairman Mandiri Institute M. Chatib Basri dan pembicara lain yang berasal dari berbagai bidang.Pada hari berikutnya akan dikemas dalam bentuk one-on-one meeting untuk memperoleh informasi terkait peluang investasi terkini, baik dari regulator maupun dari pelaku usaha yang hadir.",21+January+2019,3,"<div class=""main-image""> <a href=""#"" title=""""> <img alt="""" src=""https://img.bisnis.com/posts/2019/01/21/880964/zammandiri020119-3.jpeg""/> </a> <div class=""caption"">Aktivitas layanan perbankan di Bank Mandiri, Jakarta, Rabu (2/1/2019). - Bisnis/Abdullah Azzam</div> </div>",bisnis,"Bank Mandiri Gelar Investor Forum, Sri Mulyani Hingga Ridwan Kamil Dijadwalkan Hadir",https://finansial.bisnis.com/read/20190121/90/880964/bank-mandiri-gelar-investor-forum-sri-mulyani-hingga-ridwan-kamil-dijadwalkan-hadir
4,"Bisnis.com, JAKARTA – PT RHB Sekuritas menilai Mizuho Financial Group (MFG) akan menjadi pembeli potensial saham PT Bank Permata Tbk. Bank asal Jepang tersebut telah lama memasang mata ke industri perbankan Tanah Air.“Kami yakin pemegang saham mayoritas Bank Permata, Astra dan Standard Chartered terbuka terhadap kemungkinan divestasi,” kata analis RHB Sekuritas Alvin Baramuli dalam keterangan tertulis yang diterima Bisnis, Senin (21/1/2019).Dalam riset yang dilakukan 20 Desember 2018, Alvin menjelaskan bahwa investasi yang digelontorkan pemegang saham pengendali (PSP) akan lama mencapai titik impas. Pasalnya emiten berkode saham BNLI membukukan pendapatan kurang dari Rp1 triliun.Alvin juga menjabarkan bahwa valuasi BNLI tergolong murah dibandingkan dengan bank besar lain. Dengan kondisi perseroan saat ini, pemegang saham dapat melepas kepemilikan di bawah satu kali nilai buku atau 1x PBV (price to book value).Seperti diketahui dalam beberapa tahun terakhir, dua bank dalam negeri telah dicaplok oleh investor Jepang. PT Bank Tabungan Pensiunan Negara Tbk. dibeli oleh Sumitomo Mitsui Bangking Corporation (SMCB) pada 2013 dengan valuasi 4,5x PVB. Kemudian pada 2017—2018 Mitsubishi UFJ Financial Group (MUFG) menjadi pemegang saham mayoritas PT Bank Danamon Indonesia Tbk. dengan 2x PBV.Bisnis mencatat isu pelepasan saham BNLI oleh PSP telah muncul sejak tahun lalu. Setelah perusahaan investasi asal Amerika Serikat, kini giliran bank Jepang disebut-sebut berminat mengakuisisi.PT Astra International Tbk. dan Standard Chartered Bank selaku PSP berulang kali menyatakan komitmen untuk tetap berada di Bank Permata. Keduanya berbagi rata 89,12% kepemilikan BNLIKepala Riset Koneksi Capital Alfred Nainggolan mengatakan wacana penjualan saham dan masuknya investor baru tepat dimunculkan untuk bank yang memiliki valuasi murah. Pun tidak ada larangan memunculkan wacana pelepasan saham. Pemegang saham saat ini dan juga bank akan mendapat untung karena mendapat sentimen positif.Adapun seperti diberitakan Bisnis, Senin (21/1/2018) siang, BNLI menjadi pendorong utama terhadap berlanjutnya penguatan Indeks Harga Saham Gabungan (IHSG) pada akhir sesi I perdagangan. Saham Bank Permata melesat 23,40%.",21+January+2019,4,"<div class=""main-image""> <a href=""#"" title=""""> <img alt="""" src=""https://img.bisnis.com/posts/2019/01/21/880945/bank-permata.jpg""/> </a> <div class=""caption"">Nasabah beraktivitas di Bank Permata. - Bisnis/Dwi Prasetya</div> </div>",bisnis,"Bank Permata Diyakini Bakal Dilepas Astra dan SCB, Ini Analisisnya",https://finansial.bisnis.com/read/20190121/90/880945/bank-permata-diyakini-bakal-dilepas-astra-dan-scb-ini-analisisnya
5,"Bisnis.com, JAKARTA — PT Bank Artha Graha International Tbk. akan memfokuskan penggalangan dana murah untuk menyiasati kenaikan suku bunga dana. Hal itu sejalan dengan kenaikan target penyaluran kredit pada tahun ini.Direktur PT Bank Artha Graha International Tbk. Anas Latief mengatakan, penghimpunan dana pihak ketiga (DPK) ditargetkan tumbuh sekitar 10% - 12%. Salah satu strategi yang akan dilakukan perseroan, yakni mendorong dana murah atau current account saving account (CASA).Menurutnya, upaya tersebut dilakukan manajemen untuk menekan peningkatan biaya dana sehingga kenaikan bunga simpanan tidak berdampak terhadap penyesuaian bunga kredit secara signifikan.""Strategi meningkatkan DPK akan sama saja seperti bank-bank lain. Sepanjang penghimpunan dana murah, tabungan, dan giro bagus, kami tidak perlu banyak mengerek suku bunga meski suku bunga acuan diproyeksi masih akan naik tahun ini,"" katanya kepada Bisnis, belum lama ini.Meskipun demikian, sepanjang tahun lalu bank yang memiliki kode saham INPC ini telah melakukan penyesuaian suku bunga pada rentang 25 basis points (bps) sampai dengan 100 bps.Sembari memacu penghimpunan DPK, Anas menyampaikan bahwa perseroan juga menargetkan angka yang sama untuk penyaluran kredit pada tahun ini, yakni kisaran 12%. Angka itu, lanjutnya, jika terealisasi akan lebih tinggi dibandingkan dengan realisasi tahun lalu yang mencapai 10%.Dengan demikian, menurut Anas, rasio kredit terhadap simpanan atau loan to deposit ratio (LDR) akan dijaga pada rentang 87% - 90% tidak jauh beda dengan perolehan pada tahun lalu.Sementara itu, dalam mencapai target penyaluran kredit bank milik taipan Tomy Winata itu menyiapkan salah satu cara, yakni aktif mengikuti program pemerintah, baik pada segmen produksi melalui Kredit Usaha Rakyat atau KUR dan segmen konsumsi melalui Fasilitas Likuiditas Pembiayaan Perumahan (FLPP).Anas menyampaikan, pada tahun ini penyaluran KUR di Artha Graha dipastikan meningkat dari tahun lalu yang sebesar Rp700 miliar. Adapun untuk FLPP, tahun ini perseroan berharap dapat menyalurkan untuk 5.000 unit rumah atau naik dari tahun lalu 3.900 unit rumah.Dia mengklaim, porsi pembiayaan Artha Graha masih didominasi oleh segmen produksi dengan persentase sekitar 80%. Artinya, hanya 20% yang dialokasikan pada segmen konsumsi.Adapun, dari laporan keuangan perseroan per September 2018, Artha Graha mencatatkan penurunan laba 40% secara tahunan atau year-on-year (yoy) menjadi Rp46 miliar dibandingkan dengan Rp77 miliar pada periode yang sama tahun sebelumnya.Penurunan laba Bank Artha Graha disebabkan oleh penyusutan pendapatan bunga bersih sebesar 2,2% yoy menjadi Rp841 miliar dari periode sebelumnya sebesar Rp860 miliar. Selain itu, biaya operasional naik 1,6% yoy menjadi Rp775 miliar dari periode sama 2017 sebanyak Rp763 miliar.",21+January+2019,5,"<div class=""main-image""> <a href=""#"" title=""""> <img alt="""" src=""https://img.bisnis.com/posts/2019/01/21/880962/artha-graha.jpg""/> </a> <div class=""caption"">Ilustrasi karyawan Bank Artha Graha menawarkan produk/http:/ - bag.interaksi.web.id</div> </div>",bisnis,"Beban Dana Naik, Bank Artha Graha Pacu Dana Murah",https://finansial.bisnis.com/read/20190121/90/880962/beban-dana-naik-bank-artha-graha-pacu-dana-murah
6,"Bisnis.com, JAKARTA – Rencana Otoritas Jasa Keuangan melakukan konsolidasi perbankan dengan mendorong bank kecil menginduk pada  bank besar mendapatkan resistensi. Mereka meminta agar konsolidasi terjadi secara alami.Manajemen PT Bank of India Indonesia atau BOI Indonesia menyatakan merger perlu disesuaikan dengan kebutuhan permodalan dan dengan rencana bisnis. “[Permodalan] masih cukup untuk perkembangan bisnis ke depan,” kata Direktur BOI Indonesia Ferry Koswara kepada Bisnis, akhir pekan lalu.Lebih lanjut, Ferry menyampaikan, konsolidasi bank kecil sulit dipaksakan. Pasalnya, setiap bank kecil telah memiliki rencana bisnis masing-masing dan terbukti sejauh ini berjalan dengan baik. Selain itu, pencarian investor bukan perkara mudah.Setiap aksi korporasi membutuhkan kesepakatan dari masing-masing pihak. Apabila terlalu banyak campur tangan regulator, dia khawatir malah berpotensi terjadi pertumbuhan bisnis yang tidak natural.Presiden Direktur PT Bank Capital Indonesia Tbk. Wahyu Dwi Aji sebelumnya menyampaikan bahwa gagasan OJK pada prinsipnya bertujuan untuk mengurangi jumlah bank agar lebih efisien.Menurutnya, ide tersebut sudah lama, tetapi bank melakukan konsolidasi sesuai dengan mekanisme dan kebutuhan pasar masing-masing. Apabila OJK mendorong konsolidasi dengan bentuk holding antara bank besar dan bank kecil, dia tidak yakin hal itu akan berhasil.“Sebenarnya tidak mesti bank kecil ini diambil alih oleh bank besar. Seberapa besar bank itu yang penting kan bisa menyesuaikan dan mengikuti perkembangan asetnya,” katanya kepada Bisnis, belum lama ini.Sementara itu, pada tahun lalu, hingga Oktober, bank yang memiliki modal antara Rp1 triliun hingga Rp5 triliun tampak tertatih menjalankan fungsi intermediasi. Portofolio kredit BUKU II secara tahunan sempat beberapa kali merosot dibandingkan dengan capaian tahun lalu.Per Oktober BUKU II mencatatkan pertumbuhan kredit terbaik 8,1% yoy. Akan tetapi, masih jauh lebih rendah apabila dibandingkan dengan capaian industri perbankan yang membukukan sekitar 13% yoy.Sejumlah BUKU II mengaku persaingan memperebutkan debitur dengan BUKU III menjadi persoalan. Direktur Utama Bank Victoria Ahmad Fajar mengatakan, hal itu membut bank kecil harus berhati-hati menyalurkan dana karena harus mencari debitur kualitas kedua.Pengamat Perbankan Paul Sutaryono mengatakan, pada dasarnya gagasan regulator baik. Namun, prinsipnya hal itu tidak boleh mengganggu laju konsolidasi, yakni proses merger dan akuisisi perbankan nasional yang terjadi saat ini.",21+January+2019,6,"<div class=""main-image""> <a href=""#"" title=""""> <img alt="""" src=""https://img.bisnis.com/posts/2019/01/21/880934/manatm090418.jpeg""/> </a> <div class=""caption"">Nasabah melakukan transaksi perbankan di Galeri ATM, di Bandung, Jawa Barat, Senin (9/4/2018). - JIBI/Rachman</div> </div>",bisnis,"Pemangkasan Jumlah Bank, Bankir: Konsolidasi Jangan Dipaksakan",https://finansial.bisnis.com/read/20190121/90/880934/pemangkasan-jumlah-bank-bankir-konsolidasi-jangan-dipaksakan
7,"Pascakrisis moneter 20 tahun, negara-negara berkembang sepakat mengurangi jumlah bank.Satu negara tetangga, Malaysia terbilang sukses melakukan konsolidasi dengan menyisakan beberapa bank besar. Baca selengkapnya di siniPT Toko Modal Mitra Usaha, penyedia layanan jasa pinjam meminjam uang langsung berbasis teknologi atau fintech lending dengan brand Tokomodal, menargetkan pembiayaan hingga Rp1 triliun pada 2019.Target tersebut tetap diarahkan pada layanan pembiayaan kepada usaha kecil dengan memberikan sejumlah tawaran menarik, baca selengkapnya di siniUnit Usaha Syariah PT Bank CIMB Niaga Tbk. (CIMB Niaga Syariah) tengah menjajaki kerja sama dengan perusahaan financial technology atau fintech untuk menjadi standby investor.Deputy I Head of Syariah Banking CIMB Niaga Rusdi Dahardin mengatakan bahwa sejauh ini investor yang masuk di fintech, terutama yang bergerak di bisnis lending, masih relatif terbatas. Baca selengkapnya di siniOtoritas Jasa Keuangan (OJK) meminta bank kecil mau melakukan konsolidasi dengan bank besar. Otoritas pun berharap bank besar dapat membuka ruang untuk membantu proses itu. Baca selengkapnya di siniOtoritas Jasa Keuangan (OJK) tengah merancang dua skema kerja sama antara bank syariah dengan perusahaan financial technology (fintech) untuk meningkatkan daya saing bank syariah.Pertama, kerja sama dengan skema shadow investor atau investor bayangan. Baca selengkapnya di sini",21+January+2019,7,"<div class=""main-image""> <a href=""#"" title=""""> <img alt="""" src=""https://img.bisnis.com/posts/2019/01/21/880887/2.jpeg""/> </a> <div class=""caption"">Nasabah melakukan transaksi perbankan di galeri Anjungan Tunai Mandiri (ATM) di salah satu pusat perbelanjaan di Bandung, Jawa Barat, Senin (3/9/2018). - JIBI - Rachman</div> </div>",bisnis,"5 Berita Populer Finansial, Tokomodal Kejar Rp1 Triliun, OJK Minta Pemilik Bank Kecil Korbankan Kepentingan Pribadi",https://finansial.bisnis.com/read/20190121/90/880887/5-berita-populer-finansial-tokomodal-kejar-rp1-triliun-ojk-minta-pemilik-bank-kecil-korbankan-kepentingan-pribadi
8,"Bisnis.com, JAKARTA — Otoritas Jasa Keuangan (OJK) tengah merancang dua skema kerja sama antara bank syariah dengan perusahaan financial technology (fintech) untuk meningkatkan daya saing bank syariah.Pertama, kerja sama dengan skema shadow investor atau investor bayangan. Dalam skema tersebut, bank syariah menawarkan proyek pembiayaan melalui perusahaan teknologi finansial kepada investor. Namun, dalam penawaran tersebut tidak diberitahukan kepada investor bahwa proyek pembiayaan tersebut dimotori oleh bank syariah.Dengan skema tersebut, sumber pendanaan didapatkan dari investor yang terdaftar pada perusahaan teknologi finansial. Adapun, pemilik proyek yang akan dibiayai merupakan nasabah bank syariah terkait. Imbal hasil bagi perusahaan teknologi finansial didapat dari fee investor, sementara bank mendapatkannya dari pemilik proyek.Kedua, OJK membuat skema outsorcing platform yang merupakan kerja sama antara bank syariah dengan perusahaan teknologi finansial. Hampir mirip dengan skema pertama, perbedaannya hanya terletak pada informasi yang lebih terbuka kepada investor mengenai bank syariah sebagai promotor pembiayaan.Selain kedua skema kerja sama langsung tersebut, masih ada dua skema pengembangan fintech dan teknologi digital untuk menyalurkan pembiayaan bank syariah. Kedua skema tersebut pengembangan fintech ataupun platform pembiayaan digital secara mandiri dan secara kolektif membentuk konsorsium.Skema penerapan teknologi ini diharapkan dapat mendorong pemasaran produk Shariah Restricted Intermediary Account (SRIA) yang sedang disiapkan, dengan salah satu produk utamanya adalah Mudharabah Muqayadah.Produk tersebut digadang-gadang akan menjadi terobosan baru dalam industri perbankan syariah. Investor dapat langsung membiayai proyek yang ditawarkan melalui perbankan, dengan tenor waktu dan imbal hasil yang disepakati terlebih dahulu.Bank syariah akan terhindar dari mismatch tenor antara pembiayaan dan pendanaan. Secara teknis, dana yang disalurkan tidak akan dihitungkan ke dalam neraca bank, sehingga bank akan terhindar dari Giro Wajib Minimum dan Aktiva Tertimbang Menurut Risiko (ATMR).Direktur Penelitian, Pengembangan Pengaturan dan Perizinan Perbankan Syariah OJK Deden Firman Hendarsyah mengatakan bahwa saat ini regulator masih mendalami skema kerja sama dengan perusahaan teknologi finansial maupun produk digital secara umum dan terkotak. OJK, lanjutnya, masih menjadi pengawas dari kegiatan yang sudah ada dan masih dalam tahap pengembangannya.""Istilahnya kami itu masih regulatory sandbox, kami masih mengawasi yang sudah ada dalam kotak dan belum bisa keluar dari sana. Jadi belum secara rinci seperti apa,"" katanya kepada Bisnis, belum lama ini.Meski demikian, Deden menegaskan regulator memang tidak bisa melawan era padat teknologi. Perbankan syariah pun dapat melakukan kerja sama sebagaimana bank konvensional yakni mengakuisisi anak usaha fintech dan kerja sama baik melalui chanelling pembiayaan atau kerja sama lainnya.",21+January+2019,8,"<div class=""main-image""> <a href=""#"" title=""""> <img alt="""" src=""https://img.bisnis.com/posts/2019/01/21/880822/dpexpo051018-3.jpeg""/> </a> <div class=""caption"">Petugas memberikan penjelasan kepada pengunjung di stan peserta IB Vaganza Expo Keuangan Syariah di Jakarta, Jumat (5/10/2018). - JIBI/Dwi Prasetya</div> </div>",bisnis,OJK Rancang 2 Skema Kerja Sama Bank Syariah dan Fintech,https://finansial.bisnis.com/read/20190121/90/880822/ojk-rancang-2-skema-kerja-sama-bank-syariah-dan-fintech
