,content,date,id,images,sumber,title,url
35,"Bisnis.com, JAKARTA – Kalimantan Utara mulai mengeekspor beras Adan Krayan ke Malaysia dan Brunei Darusalam setelah berhasil swasembada beras untuk konsumsi lokal.Kadis Pertanian dan Ketahanan Pangan (DPKP) Kaltara Andi Santiaji mengatakan, ekspor beras Adan Krayan ke Malaysia dan Brunei Darussalam secara periodik akan mencapai puluhan ton.""Ini terobosan Pemprov Kaltara, pemerintah daerah dan pusat. Untuk pertama, pemerintah memfasilitasi ekspor beras Adan Krayan yang simbolis dilakukan di Krayan, Nunukan pada Kamis (17/1/2019) lalu.""""Ekspor ini berhasil karena pemprov berhasil meyakinkan Malaysia dan Brunei Darussalam untuk menerima beras Adan Krayan,"" kata Andi dari siaran pers Pemprov Kaltara, Senin (21/1/2019).Dia mengatakan, beras Adan Krayan memiliki keunggulan sebagai komoditas yang mengantongi sertifikat Indikasi Geografis (IG) dari Direktorat Jenderal Kekayaan Intelektual (DJKI).Adapun di Krayan, luasan sawah padi untuk memproduksi 14.000 ton gabah kering panen (GKP) beras Adan atau rerata mencapai 8.500 ton di atas lahan 3.466 hektare.""Kami dari Dinas Pertanian dan Pemkab Nunukan mendurukan dan terus mendorong para petani lokal agar meningkatkan produksinya sehingga ke depan wilayah Krayan ini bisa menjadi lumbung pangan berorientasi ekspor,"" kata Andi.",21+January+2019,0,"<div class=""main-image""> <a href=""#"" title=""""> <img alt="""" src=""https://img.bisnis.com/posts/2019/01/21/881004/sut-beras-banjarmasin.jpg""/> </a> <div class=""caption"">Aktivitas pedagang beras lokal di Pasar Sentral Antasari Banjarmasin, Kamis (20/9/2018). - Bisnis/Arief Rahman</div> </div>",bisnis,Kaltara Ekspor Beras Adan ke Malaysia dan Brunei Darussalam,https://ekonomi.bisnis.com/read/20190121/99/881004/kaltara-ekspor-beras-adan-ke-malaysia-dan-brunei-darussalam
36,"Bisnis.com, JAKARTA – Pertumbuhan ekonomi Indonesia yang ditargetkan sebesar 5,3% bakal sulit dicapai akibat dampak slowdown China yang diperkirakan cukup masif.Ekonom Indef Bhima Yudhistira menuturkan perlambatan ekonomi China berpotensi mengurangi permintaan bahan baku dari Indonesia baik komoditas energi, tambang, perkebunan maupun perikanan.""Efeknya kinerja ekspor tahun ini diperkirakan hanya ada dikisaran 6-7%,"" kata Bhima, Senin (21/1/2019).Porsi ekspor Indonesia ke China cukup besar, yakni sekitar 15% pada 2018 atau sebesar US$24,3 miliar.Sementara itu, melemahnya permintaan China membuat harga komoditas dalam proses pemulihan yang lebih lama baik minyak mentah, batubara, sawit, dan karet.Otomatis pendapatan masyarakat yang bekerja di sektor komoditas khususnya di Kalimantan dan Sumatra tertekan.""Pertumbuhan ekonomi didaerah berbasis komoditas prospeknya turun,"" tambah Bhima.Lebih lanjut, Bhima menuturkan pelemahan ekonomi di China akan membuat investor sektor keuangan investor mencari aman dengan mengalihkan dana ke surat utang dan mata uang yen Jepang.Ini terlihat dari respons rupiah yang melemah di level Rp14.220 atau 0,35% pada sesi perdagangan siang ini, Senin (21/1).Alhasil, investor akan menunda masuk ke Indonesia melihat outlook ekonomi global yang slowdown.""FDI di tahun 2019 sulit untuk diharapkan,"" ujar Bhima.Terlebih lagi bertepatan dengan Pilpres, investor akan cenderung 'wait and see' seiring perbaikan data ekonomi China.Namun, Bhima ragu ekonomi China akan membaik dalam waktu dekat, selama perang dagang belum diakhiri.""Konsekuensinya growth akan berkisar 5,0-5.1% tahun ini,"" ungkapnya.Oleh karena itu, Bhima berharap pemerintah terus memperkuat penetrasi ke pasar nontradisional, melakukan hilirisasi industri sehingga lebih imun terhadap fluktuasi harga commodity, dan memberikan insentif ke sektor berorientasi ekspor.Ekonom dari CSIS Mari Elka Pangestu menilai pertumbuhan ekonomi Indonesia bisa sedikit lebih rendah karena keadaan eksternal yang tidak pasti. Tentunya, ini akan berpengaruh ke ekspor dan keinginan untuk investasi.""Tapi harusnya pertumbuhannya bisa sekitar 5% karena sumber pertumbuhan dalam negeri, konsumsi dan belanja pemerintah, plus investasi. Ini yang perlu dijaga,"" tegas Mari.Saat ini, dia menilai kebijakan makro sudah relatif tepat karena fokus ke stabilitas di tengah keadaan tidak pasti, dibandingkan mengejar pertumbuhan tinggi.Dia menilai kebijakan Fiskal dapat fokus ke belanja dalam negeri yang bisa menciptakan stimulus, maupun menjaga daya beli masyarakat. Contohnya, dukungan untuk kesehatan, pendidikan, Dana Desa serta kebijakan di pajak dan bea cukai yang mendukung.Sementara itu, kebijakan moneter fokus ke stabilitas rupiah dan menjaganya dari risiko volatilitas arus modal dengan menaikan suku bunga.Di sisi lain, Mari menyoroti tantangan berbagai reformasi yang diperlukan untuk mendorong daya saing ekspor barang maupun jasa-Jasa dan menarik investasi.Dengan ketidakpastian iklim perdagangan, dia melihat banyak perusahaan akan mengalihkan sebagian produksinya keluar dari China dan akan ada perubahan global value chain dimana Asia Tenggara menarik sebagai tempat relokasi.Dia menilai Indonesia perlu bersaing dalam hal ini. ""Reformasi diharapkan. Namun menunggu setelah Pemilu.""",21+January+2019,1,"<div class=""main-image""> <a href=""#"" title=""""> <img alt="""" src=""https://img.bisnis.com/posts/2019/01/21/881003/yuan.jpg""/> </a> <div class=""caption"">Yuan - Bloomberg</div> </div>",bisnis,"Dinamika Ekonomi China Bakal Sulitkan Target 5,3% Pertumbuhan Indonesia",https://ekonomi.bisnis.com/read/20190121/9/881003/dinamika-ekonomi-china-bakal-sulitkan-target-53-pertumbuhan-indonesia
37,,21+January+2019,2,"<div class=""main-image""> <a href=""#"" title=""""> <img alt="""" src=""https://img.bisnis.com/posts/2019/01/21/880979/timorleste-280618-5.jpg""/> </a> <div class=""caption"">Presiden Joko Widodo (kiri) mempersilakan Presiden Timor Leste Francisco Guterres Lu Olo untuk menyampaikan keterangan pers bersama saat kunjungan kenegaraan di Istana Bogor, Jawa Barat, Kamis (28/6/2018). - ANTARA/Puspa Perwitasari</div> </div>",bisnis,RI-Timor Leste Kerja Sama di Bidang Penerbangan,https://ekonomi.bisnis.com/read/20190121/98/880979/ri-timor-leste-kerja-sama-di-bidang-penerbangan
38,"Bisnis.com, JAKARTA - Pemerintah melalui Dewan Nasional Keuangan Inklusif (DNKI) telah memetakan 6 (enam) fokus kegiatan inklusi keuangan di Indonesia untuk tahun 2019.",21+January+2019,3,"<div class=""main-image""> <a href=""#"" title=""""> <img alt="""" src=""https://img.bisnis.com/posts/2019/01/21/880984/paketekonomi161118-4.jpg""/> </a> <div class=""caption"">Menteri Koordinator Perekonomian Darmin Nasution mengumumkan Paket Kebijakan Ekonomi XVI di Kantor Presiden, Kompleks Istana Kepresidenan, Jakarta, Jakarta, Jumat (16/11/2018). - ANTARA/Puspa Perwitasari</div> </div>",bisnis,Pemerintah Petakan 6 Fokus Kegiatan Inklusi Keuangan,https://ekonomi.bisnis.com/read/20190121/9/880984/pemerintah-petakan-6-fokus-kegiatan-inklusi-keuangan
39,"Bisnis.com, JAKARTA — Direktorat Jenderal Bea dan Cukai (DJBC) Kementerian Keuangan menyebut bahwa implementasi PMK.210/PMK.010/2018 yang mengatur tentang kebijakan perpajakan bagi e-commerce memudahkan bagi pelaku usaha.Dalam ketentuan tersebut terdapat kewajiban bagi penyedia platform marketplace untuk menggunakan skema delivery duty paid (DDP). DDP sendiri kerap diartikan sebagai penyerahan dilakukan di negara yang melakukan impor, tetapi bea masuk sudah dibayar dan diselesaikan, dengan begitu penjual wajib memikul semua biaya dan risiko sampai dengan barang tiba di negara tujuan.Direktur Jenderal (Dirjen) Bea dan Cukai Kemenkeu Heru Pambudi mengatakan bahwa sebenarnya dengan skema DDP, pemerintah mendapat banyak keuntungan karena setiap kali melakukan transaksi dengan skema itu, pemerintah mendapatkan kepastian dari aspek perpajakannya.Salah satunya mengenai bea masuk misalnya, barang yang dibeli sudah mencakup dengan pembayaran bea masuk.""Jadi dengan skema ini sebenarnya semuanya diuntungkan. Dan pelaku usaha juga sama,"" kata Heru saat ditemui di gedung DPR, pekan lalu.Adapun jika merujuk ketentuan tersebut, skema DDP diwajibkan kepada penyedia platform e-commerce. Jika mereka tidak menggunakan skema tersebut, Kepala Kantor Kepabeanan bisa mencabut persetujuan pendaftaran penyedia platform marketplace.Ketentuan baru mengenai perlakuan perpajakan bagi e-commerce tak hanya mengatur mengenai mekanisme pemajakannya, tetapi juga terkait dengan kewajiban para pelaku usaha dalam aspek kepabenanan.",21+January+2019,4,"<div class=""main-image""> <a href=""#"" title=""""> <img alt="""" src=""https://img.bisnis.com/posts/2019/01/21/880980/jodicukai170918-4.jpeg""/> </a> <div class=""caption"">Direktur Jenderal Bea dan Cukai Heru Pambudi memberikan paparan dalam konferensi pers terkait ketentuan impor barang kiriman di Jakarta, Senin (17/9/2018). - JIBI/Felix Jody Kinarwan</div> </div>",bisnis,DJBC Klaim Skema Delevery Duty Paid (DDP) Beri Kepastian,https://ekonomi.bisnis.com/read/20190121/259/880980/djbc-klaim-skema-delevery-duty-paid-ddp-beri-kepastian
40,"Bisnis.com, JAKARTA - Direktorat Jenderal Bea dan Cukai terus memperkuat fungsi Bea Cukai dengan meresmikan Balai Laboratorium Bea Cukai.Dikutip dalam laman resminya Senin (21/1/2019), Dirjen Bea dan Cukai Kemenkeu Heru Pambudi mengatakan adanya perubahan pola perdagangan global, semakin berkembangnya teknologi dan bertambahnya keberagaman jenis barang menyebabkan Laboratorium harus menyesuaikan dengan perkembangan zaman dan mengikuti standar dan praktik terbaik internasional.""Dengan adanya penguatan fungsi laboratorium Bea Cukai ini kami berharap dapat memberikan kemudahan kepada petugas Bea Cukai dan para pengguna jasa untuk memperoleh hasil pengujian dan identifikasi barang dengan lebih cepat,"" kata Heru, Senin (21/1/2019).Sampai akhir 2018, Bea Cukai telah membangun 12 satuan pelayanan Laboratorium Bea Cukai yang tersebar di seluruh Indonesia ditambah dengan 3 unit mobil laboratorium sebagai sarana pendukung pelaksanaan pengujian dan identifikasi barang di kantor-kantor pelayanan yang belum dilengkapi dengan keberadaan laboratorium Bea dan Cukai.Heru menambahkan dengan diresmikiannya Laboratorium Bea Cukai ini nantinya dapat meningkatkan pelayanan laboratoris dan identifikasi barang baik dari aspek kecepatan, ketepatan maupun akurasi diantaranya dengan melakukan otomasi prosedur pengajuan pengujian lab dan penerbitan hasil uji lab melalui aplikasi CEISA Lab BC, mempercepat pelayanan ekspor barang-barang strategis yang semula membutuhkan waktu 5,2 hari menjadi 6 jam sebagaimana telah dapat dilakukan untuk ekspor CPO dan produk turunannya di Dumai.""Ini sekaligus membantu para pelaku usaha di bidang ekspor dan impor dengan layanan yang cepat sehingga biaya usaha dapat ditekan,” ujar Heru.",21+January+2019,5,"<div class=""main-image""> <a href=""#"" title=""""> <img alt="""" src=""https://img.bisnis.com/posts/2019/01/21/880974/jodicukai200918-3.jpeg""/> </a> <div class=""caption"">Direktur Jenderal Bea dan Cukai Heru Pambudi memberikan paparan dalam konferensi pers terkait rokok ilegal di Jakarta, Kamis (20/9/2018). - JIBI/Felix Jody Kinarwan </div> </div>",bisnis,DJBC Terus Dorong Efektivitas Arus Barang,https://ekonomi.bisnis.com/read/20190121/259/880974/djbc-terus-dorong-efektivitas-arus-barang
41,"Bisnis.com, JAKARTA - PT Timah Tbk. menargetkan purwarupa atau prototipe penambangan timah di laut bisa diselesaikan tahun ini.Direktur Utama Timah Mochtar Riza Pahlevi Tabrani mengatakan bahwa pihaknya akan mengedepankan aspek lingkungan dalam penambangan laut tersebut. Prototipe tersebut diharapkan sudah bisa diterapkan mulai tahun depan.""Yang laut prototipenya mudah-mudahan tahun ini selesai. Yang pasti sifatnya ramah lingkungan,"" ujarnya usai rapat dengar pendapat bersama Komisi VII DPR, Senin (21/1/2019).Nantinya, sistem penambangan di laut tersebut akan menggunakan bor seperti yang dilakukan pada minyak dan gas bumi (migas). Teknologi tersebut diklaim ramah lingkungan.Adapun, penyelesaian tersebut rencana disesuikan dengan penetapan zonasi laut di Provinsi Kepulauan Bangka Belitung.Selain akan melakukan penambangan di laut, Timah juga tengah melakukan ekspansi ke nigeria sebagai salah satu upaya pengembangan bisnisnya. Namun, Riza belum memastikan kapan ekspansi tersebut mulai bisa mengerek produksi Timah.""Eksplorasi tidak bisa buru-buru. Kita lihat lahannya, kondisi sosial. Saya pikir masih fokus di situ,"" tuturnya.Seperti diketahui, pada Desember 2017, Timah telah melaksanakan penandatanganan joint venture agreement dengan TopWide Venture Ltd di Abuja, Nigeria. Kesepakatan itu mencakup kerja sama untuk melakukan studi kelayakan untuk investasi, survei pemetaan geologi, pengeboran eksplorasi awal dan perolehan sampel secara detail.Sebelumnya, Sekretaris Perusahaan Timah Amin Haris Sugiarto menyampaikan sampai dengan kuartal III/2018, perusahaan merealisasikan capex 60% dari anggaran atau senilai Rp793 miliar. Pada 2019, nilai capex meningkat 28% dari tahun ini.""Capex pada 2019 akan ada peningkatan 28%, pendanaannya dari internal dan pinjaman eksternal,"" katanya.Dari sisi kinerja keuangan, manajemen Timah membidik laba bersih yang lebih tinggi pada tahun depan dibandingkan dengan realisasi 2018. Hal ini didorong oleh faktor internal dan eksternal industri timah.Secara internal, Timah akan menambah kapasitas alat produksi dan merampungkan proyek peleburan pada 2019. Adapun, dari sisi eskternal, iklim bisnis timah semakin membaik seiring dengan dukungan penyetopan tambang-tambang ilegal.Per September 2018, Timah mengantongi laba bersih Rp255,54 miliar, turun 14,98% yoy dari sebelumnya Rp300,57 miliar. Padahal, pendapatan meningkat 2,7% yoy menuju Rp6,8 triliun dari posisi per September 2017 sebesar Rp6,62 triliun.",21+January+2019,6,"<div class=""main-image""> <a href=""#"" title=""""> <img alt="""" src=""https://img.bisnis.com/posts/2019/01/21/880972/deditimah020119-2.jpeg""/> </a> <div class=""caption"">Angkutan umum roda tiga menunggu calon penumpang di depan kantor PT Timah Tbk di Jakarta, Rabu (2/1/2018). - Bisnis/Dedi Gunawan</div> </div>",bisnis,Prototipe Tambang Timah di Laut Tuntas Tahun Ini,https://ekonomi.bisnis.com/read/20190121/44/880972/prototipe-tambang-timah-di-laut-tuntas-tahun-ini
42,"Bisnis.com, JAKARTA - PT Chevron Pacific Indonesia menjadi kontraktor kontrak kerja sama (KKKS) yang menghasilkan limbah terbanyak sepanjang 2018.Selain Chevron, dalam catatan Kementerian ESDM, terdapat sembilan kontraktor lain yang menghasilkan limbah bahan berbahaya dan beracun (B3).Dalam hal ini, Kementerian ESDM mengkategorikan limbah tersebut kedalam 3 kategori yakni tanah terkontaminasi sebanyak 30.987,51 ton, limbah sisa operasi sebanyak 6.081,22 ton dan limbah sisa produksi sebanyak 33.128,62 ton.Jika dirinci, untuk Chevron di Blok Rokan menghasilkan limbah tanah terkontaminasi sebesar 27.275 ton dengan biaya pengolahan limbah US$ 3,2 juta.Adapun, limbah sisa operasinya sebesar 3.515 ton dengan biaya pengelolaan sebesar US$ 1,4 juta dan limbah sisa operasinya nihil alias 0 ton.Dalam paparan bersama Komisi VII DPR, Direktur Teknik dan Lingkungan Migas Kementerian ESDM Adhi Wibowo menuturkan bahwa Chevron menjadi penghasil terbesar limbah karena sesuai dengan luas wilayah Blok Rokan.Jumlah sumur yang beroperasi di Blok Rokan mencapai lebih dari 18.000 sumur.Meski menjadi penghasil limbah terbesar, tetapi berdasarkan Undang-Undang Nomor 22/2001 tentang Migas, Peraturan Pemerintah Nomor 35 tahun 2004, dan Peraturan Menteri ESDM Nomor 31 tahun 2012, Chevron menganggarkan dana pascatambang untuk mengelola limbah tersebut.Senior Vice President Policy, Government and Public Affrairs Chevron Wahyu Budianto mengatakan bahwa pihaknya sudah berupaya agar limbah tersebut dikelola dengan baik.""Seluruh limbah kita kelola dengan baik, kan kita punya limbah domestik dan lainnya. Kalau limbah domestik nanti kami bagi mana organik dan nonorganik, kemudian limbah operasi kayak kaos tangan yang kotor dan oli itu kami selesaikan juga,"" kata Wahyu, Senin (21/1).Adapun, selain Chevron, 9 kontraktor KKKS yang juga menghasilkan banyak limbah yaitu pertama, PT Pertamina EP menghasilkan tanah terkontaminasi sebanyak 1.992 ton, sisa operasi 1.283 ton dan sisa produksi 15.182 ton.Kedua, PetroChina Internasional Jabung Ltd menghasilkan limbah tanah terkontaminasi sebanyak 1.647 ton, limbah sisa operasi 148 ton, dan sisa produksi 3.158 ton.Ketiga, PT Pertamina Hulu Mahakam menghasilkan limbah tanah terkontaminasinya nihil, sementara limbah sisa operasinya 239 ton, dan sisa produksi 13.252 ton.Keempat, Medco E&P Natuna menghasilkan 0,2 ton untuk tanah terkontaminasi, sisa operasi 181 ton, dan sisa produksi 71,9 ton.Kelima, PT Pertamina Hulu Sanga-Sanga untuk limbah tanah terkontaminasi 0 ton, limbah sisa operasinya sebesar 121,8 ton, dan limbah sisa produksinya 1.362 ton.Keenam, ConocoPhilips (Grissik) Ltd untuk tanah terkontaminasi sebesar 19 ton, sisa operasi sebesar 237 ton, dan sisa produksi 13 ton.Ketujuh, Pertamina Hulu Energi OSES Ltd untuk tanah terkontaminasi dan limbah sisa produksi nihil, namun limbah sisa operasi sebesar 152,50 ton.Kedelapan, ExxonMobil Cepu Ltd untuk tanah terkontaminasi mencapai 3,31 ton, limbah sisa operasi sebesar 102,9 ton, dan limbah sisa produksi 88,6 ton.Kesembilan, Pertamina Hulu Energi ONWJ untuk tanah terkontaminasi nihil, untuk limbah sisa operasi 99,4 ton, dan limbah sisa produksi mencapai 1,2 ton.Untuk diketahui, total dana untuk pengelolaan limbah yang digelontorkan oleh 10 KKKS tersebut sepanjang 2018 senilai US$12.174.528,5 untuk total keseluruhan tonase limbah sebanyak 70.197,35 ton limbah B3.",21+January+2019,7,"<div class=""main-image""> <a href=""#"" title=""""> <img alt="""" src=""https://img.bisnis.com/posts/2019/01/21/880968/chevron.jpg""/> </a> <div class=""caption"">Chevron - Reuters</div> </div>",bisnis,"PENGELOLAAN MIGAS, Chevron Penyumbang Limbah B3 Terbesar",https://ekonomi.bisnis.com/read/20190121/44/880968/pengelolaan-migas-chevron-penyumbang-limbah-b3-terbesar
43,"Bisnis.com, JAKARTA – Pemerintah Indonesia dan Hongkong  berkomitmen untuk meningkatkan perlindungan dan kesejahteraan pekerja migran Indonesia (PMI) yang bekerja di Hong Kong.Hal tersebut diungkapkan Menteri Ketenagakerjaan (Menaker) M. Hanif Dhakiri saat menerima kunjungan Sekretaris Buruh dan Kesejahteraan Hong Kong, Law Chi Kwong, di Kantor Kemnaker Jakarta pada Senin (21/1/2019).“Saya sangat mengapresiasi kerja sama dan komitmen pemerintah Hong Kong dalam hal perlindungan terhadap pekerja migran Indonesia, khususnya dalam hal jaminan sosial dan kenaikan gaji,” kata Hanif, dikutip dari keterangan resminya.Hanif menjelaskan pemerintah Hong Kong menaikkan gaji pekerja migran Indonesia dari HKD 4,410 menjadi HKD 4,520 sejak September 2018 dan peningkatan sanksi/hukuman bagi agensi yang melanggar aturan dalam amandemen Employment Ordinance.“Saya juga berharap pemerintah Hong Kong dapat menyusun standar gaji bagi para pekerja yang telah bekerja selama lebih dari 5 tahun, sehingga terdapat perbedaan antara gaji pekerja baru dan pekerja lama yang tentunya telah berpengalaman,"" ujar Hanif.Selain gaji, ungkapnya, bentuk lain perlindungan bagi pekerja migran adalah melalui pemberian jaminan sosial. Pemerintah Hong Kong mendorong dan mendukung seluruh pekerja migran untuk memiliki jaminan sosial sesuai dengan regulasi yang berlaku.“Regulasi yang berlaku di Indonesia pun mengatur bahwa setiap pekerja migran Indonesia wajib ikut serta dalam program jaminan sosial yang diselenggarakan oleh BPJS,” tuturnya.Ke depannya, Hanif berharap bahwa BPJS Indonesia dapat bekerjasama lebih erat dengan badan penyelenggara jaminan sosial di Hong Kong.Hong Kong merupakan salah satu tempat tujuan penempatan pekerja migran Indonesia, khususnya pada sektor non-formal. Per bulan Desember 2018, tercatat sejumlah 165.907 orang WNI bekerja sebagai asisten rumah tangga di Hong Kong.Namun demikian, meskipun pemerintah Hong Kong telah berupaya semaksimal mungkin untuk menjamin perlindungan pekerja migran yang bekerja di Hong Kong, Hanif  memandang perlunya dilaksanakan pertemuan rutin tahunan bagi kedua negara untuk membahas hal-hal teknis terkait permasalahan pekerja migran Indonesia beserta solusinya.Sementara itu, Sekretaris Buruh dan Kesejahteraan Hong Kong, Law Chi Kwong, mengungkapakan, permintaan terhadap pekerja Indonesia jumlahnya terus meningkat.“Banyak permintaan terhadap pekerja migran Indonesia dan hal itu disambut positif dengan banyaknya calon pekerja Indonesia yang berminat untuk bekerja di Hong Kong,” ujar Law.Selain itu, pihaknya juga akan terus meningkatkan komitmen terhadap perlindungan pekerja Indonesia khususnya dalam bidang keuangan dan juga pelatihan.“Sebagai contoh Pemerintah Hong Kong sudah melakukan Pelatihan Pembantu Rumah Tangga Asing untuk Perawatan Lansia (Pilot Scheme Training for Foreign Domestic Helper on Elderly Care) yang turut diikuti oleh 11 orang pekerja migran Indonesia,” katanya.",21+January+2019,8,"<div class=""main-image""> <a href=""#"" title=""""> <img alt="""" src=""https://img.bisnis.com/posts/2019/01/21/880966/19-taiwan-htr2.jpg""/> </a> <div class=""caption"">Buruh migran Indonesia sedang berlatih meracik minuman bubble tea di Taiwan yang diselenggarakan oleh Global Workers' Organization (GWO), LSM Taiwan, Minggu (8/7/2018). - Bisnis/Hery Trianto</div> </div>",bisnis,Indonesia dan Hong Kong Menyepakati Perlindungan Pekerja Migran,https://ekonomi.bisnis.com/read/20190121/12/880966/indonesia-dan-hong-kong-menyepakati-perlindungan-pekerja-migran
44,"Bisnis.com, JAKARTA--Pembentukan fintech pelat merah penyedia sistem pembayaran ditargetkan mulai meluncur pada kuartal pertama 2019.Deputi Bidang Usaha Jasa Keuangan, Jasa Survei, dan Konsultan Kementerian BUMN Gatot Trihargo mengungkapkan pembentukan entitas baru yang mewadahi layanan pembayaran tersebut akan mengintegrasikan layanan pembayaran digital sejumlah perusahaan pelat merah.""Belum final, tapi mudah-mudahan bulan depan sudah bisa terbentuk,"" ujarnya di kantor Kemenko Perekonomian, Senin (21/1)Penyatuan sistem pembayaran digital itu dapat meningkatkan efisiensi dari biaya interoperabilitas masing-masing BUMN yang turut berpartisipasi di dalamnya.Deputi Gubernur Bank Indonesia Sugeng mengaku belum menerima pengajuan lisensi baru dari deretan perusahaan pelat merah yang disebut akan bergabung dalam adopsi sistem pembayaran digital berbasis pemindaian kode QR itu.""Prinsipnya sih tidak masalah, asal standarnya harus disesuaikan dengan standar kita,"" ujarnya.Sebelumnya, Direktur Utama PT Bank Mandiri Tbk Kartika Wirjoatmodjo menyebut enam perusahaan pelat merah berencana untuk berkolaborasi dalam pembentukan tekfin pembayaran digital pelat merah berteknologi pemindaian kode QR.Enam perusahaan itu disebutnya meliputi bank yang tergabung dalam Himpunan Bank Milik Negara  yaitu BRI, BNI, BTN, dan Bank Mandiri. Di samping itu, terdapat dua perusahaan pelat merah lain yakni PT Telkom Indonesia (Persero) Tbk dan PT Pertamina (Persero) yang turut berpartisipasi dalam pembentukan sistem pembayaran digital terintegrasi itu.Dirinya juga menyebut tekfin sistem pembayaran digital tersebut bakal beroperasi secara komersial mulai kuartal pertama 2019.",21+January+2019,9,"<div class=""main-image""> <a href=""#"" title=""""> <img alt="""" src=""https://img.bisnis.com/posts/2019/01/21/880959/sut-tekfin.jpg""/> </a> <div class=""caption"">Profil bisnis teknologi finansial di Indonesia. - Bisnis/Radityo Eko</div> </div>",bisnis,Fintech Pembayaran Digital BUMN Segera Meluncur,https://ekonomi.bisnis.com/read/20190121/9/880959/fintech-pembayaran-digital-bumn-segera-meluncur
45,"Bisnis.com, JAKARTA – Peraturan Menteri (Permen) Perindustrian mengenai kawasan industri (KI) halal dinilai perlu dirampungkan untuk memperkuat citra Indonesia sebagai produsen produk halal juga sebagai negara dengan penduduk muslim terbanyak di dunia.Hal tersebut disampaikan ekonom Center of Reform on Economics (Core) Indonesia Ina Primiana kepada Bisnis, Senin malam (21/01/2019). Ina menjelaskan permen tersebut perlu dirampungkan agar sejalan dengan UU 34/2014 tentang Jaminan Produk Halal yang pelaksanaannya akan dilakukan pada 17 Oktober 2019.Menurutnya, sebagai negara berpenduduk muslim terbanyak, Indonesia perlu menguatkan industri dengan sertifikasi halal. Selain baik untuk pasar dalam negeri, pengembangan industri yang dinaungi regulasi pun dapat menunjang ekspor produk-produk bersertifikasi halal ke negara-negara berpenduduk muslim, seperti di kawasan Timur Tengah.""Artinya adanya KI halal memperkuat positioining kita bahwa kita memang negara yang mayoritas [beragama] Islam. Produk dari KI halal lebih meningkat kepercayaannya [di negara tujuan ekspor berpenduduk muslim],"" ujar Ina kepada Bisnis.Keberadaan KI halal yang memproduksi produk halal pun menurutnya dapat bermanfaat bagi pasar domestik. Produk industri tersebut, menurut Ina, selain dikonsumsi penduduk Indonesia juga berpotensi dikonsumsi turis yang berkunjung ke Indonesia.Hal tersebut menurutnya akan semakin meningkatkan citra Indonesia sebagai negara berpenduduk muslim terbanyak, baik industrinya maupun produk-produknya.",21+January+2019,10,"<div class=""main-image""> <a href=""#"" title=""""> <img alt="""" src=""https://img.bisnis.com/posts/2019/01/21/880949/ilustrasi-produk-halal-reuters-darren-staples-msl.jpg""/> </a> <div class=""caption"">Ilustrasi produk halal. - Reuters/Darren Staples</div> </div>",bisnis,Ini Urgensi Kehadiran Beleid Kawasan Industri Halal,https://ekonomi.bisnis.com/read/20190121/257/880949/ini-urgensi-kehadiran-beleid-kawasan-industri-halal
